1492,essere insopportabile,1,2,0.0,2,1,0,-0.3125,0.0,0.0476,1,0.0,0.0,
1493,essere bello abbracciare albero vivere mondo fiaba votero claudio cavilli realta come conoscere proprio zanzara volta andare oltre,0,29,0.0,3,1,3,0.0822,0.1111,0.0077,1,0.725,1.0,
1494,poi chiedere suo dimissione,0,7,0.0,1,0,0,0.0312,0.0,0.0,0,0.0,0.0,
1495,centro sociale danno voto sinistra pertanto non venire toccare stare complice,1,15,0.0667,1,0,2,-0.0124,0.0,0.0,0,-0.022222222222222227,0.05555555555555556,
1496,essere tutto,0,4,0.0,2,1,0,0.0,0.0,0.0,0,0.0,0.0,
1497,reddito cittadinanza disoccupato essere utile contrastare poverta ed incrementare consumo soldo essere non buttare cosa inutile potere qui fare lungo elenco,0,38,0.0263,3,0,3,-0.0123,0.0,0.0,0,-0.08333333333333333,0.20000000000000004,
1498,rispettare infermiere,0,1,0.0,1,0,0,0.2446,0.0,0.0,0,0.0,0.0,
1499,sapere questo notte fare indigestione,1,7,0.0,1,0,0,-0.1875,0.0,0.0,0,0.0,0.0,
1500,nessuna tutto buono fuori avvelenato dentro opus fare sparire stare rovinare italia,1,14,0.0,3,0,4,-0.1106,0.0833,0.0,0,-0.35,0.6000000000000001,
1501,votero no faccia renzi tutto suo lecconi mandare casa questo giro,1,19,0.0,1,0,0,0.005,0.0909,0.0,0,0.0,0.0,
1502,incubo,1,2,0.0,3,0,2,-0.125,0.0,0.0,0,0.0,0.0,
1503,voto no cerchero convincere piu possibile gente votare no,0,14,0.1429,1,0,0,0.0179,0.0,0.0,0,0.0,1.0,
1504,reale essere ascoltatore chiamare ad essere surreale face_with_tears_of_joy ,0,11,0.0,2,0,2,-0.0252,0.0,0.0,0,0.225,0.65,
1505,quanto cazzata sparare andare matteo,1,5,0.0,2,0,1,-0.0088,0.0,0.0278,1,-0.6,0.8,
1506,non credo soda caustico digerire,1,9,0.0,3,2,4,-0.0097,0.0,0.0,0,-0.4,0.6,
1507,matteo potere contare,0,5,0.0,2,1,0,-0.0117,0.0,0.0,0,0.0,0.0,
1508,giorno cui dio mettere segno clamoroso autogol,0,11,0.0,1,0,0,0.0371,0.0,0.0,0,0.0,0.0,
1509,avere imparare poco leggero questo qua portare pazienza,0,10,0.0,1,0,1,0.0174,0.0,0.0,0,0.10625000000000001,0.6,
1510,non sbagliare ieri sera avere cambiare canale,0,8,0.0,1,0,0,0.1603,0.0,0.0,0,-0.25,0.48333333333333334,
1511,gia essere qui ad aspettare non saluto mai ciao,0,13,0.0,2,0,1,-0.0066,0.0,0.0,0,0.0,0.0,
1512,cambio canale,0,2,0.0,1,0,0,0.0017,0.0,0.0,0,0.0,0.0,
1513,andare salvini sei grande capitano,0,5,0.0,1,0,0,0.1113,-0.2,0.0,0,0.8,0.75,
1514,presente capitano,0,2,0.0,2,1,0,-0.0312,0.0,0.0,0,0.0,0.0,
1515,gallina piu odioso non guardo piu meglio guardare film,1,14,0.0,3,0,2,-0.2115,0.0,0.0185,1,0.0,0.0,
1516,poveracce sempre tivu fare bullioniste,1,8,0.0,1,0,1,-0.0078,0.6,0.0,0,0.0,0.0,
1517,mario,0,2,0.0,1,0,0,0,0.0,0.0,0,0,0,
1518,avere ragione,0,3,0.3333,2,0,1,0.2678,0.0,0.0,0,0.2857142857142857,0.5357142857142857,
1519,ovviamente no non essere solo face_with_tears_of_joy ,0,7,0.0,2,0,1,0.125,0.0,0.0,0,0.0,0.5,
1520,essere cancellare tutto ignoranza,1,8,0.0,3,0,2,0.1211,0.0,0.0,0,0.0,0.0,
1521,indigesto,1,1,0.0,1,0,0,-0.3125,0.0,0.0,0,0.0,0.0,
1522,vomito,1,1,0.0,2,1,0,-0.0625,0.0,0.0,0,0.0,0.0,
1523,vuoto perdere,0,3,0.0,1,0,0,-0.124,0.0,0.0,0,-0.1,0.5,
1524,avere conoscere ex jugoslavo tanto zingaro come giustamente chiama come presentare essere artigiano cantante violinista eccezionale quello essere sbarcare italia essere delinquente suo tempo cacciare quello paese ricordo pubblico presente iugoslavia pena era certo sotto regime titolo compagno tanto democratico oggi pena era certo molto volta definitivo pensare dire figlio profugo avere preferire tornare italia rimanere cittadino italiano non avere usufruire albergo stare sistemare baracca italiano questo stare trattamento,1,113,0.0,5,0,9,0.0414,0.0145,0.0038,2,0.1638888888888889,0.32341269841269843,
1525,aggiungere ligandi non potere sopportare essere mostro intelligenza vivo pdf,1,17,0.0,1,0,1,-0.0622,0.2,0.0,0,0.1,0.4,
1526,voto no,0,3,0.0,1,0,0,0.0078,0.0,0.0,0,0.0,0.0,
1527,ieri essere mio zona sei grande,0,8,0.0,1,0,0,0.0385,0.0,0.0,0,0.0,0.1,
1528,no manco pensare,0,5,0.0,3,3,1,-0.0028,0.0,0.0,0,0.0,0.0,
1529,riforma fa cagare dire voto almeno legge fare piu fretta governo essere piu stabile risparmiera qualcosa stipendio attuale senatore,0,34,0.0,3,0,3,-0.0151,0.0,0.0076,1,0.06666666666666667,0.43333333333333335,
1530,spiacere bambina segnale continuare ad essere evidente,0,13,0.0,2,0,2,-0.0453,0.0,0.0,0,-0.22916666666666666,0.6666666666666666,
1531,dire molto italiano evitare guardare rete sera merito,0,16,0.0,1,0,0,0.097,0.0,0.0,0,0.0,0.0,
1532,zero,0,1,0.0,1,0,0,0,0.0,0.0,0,0,0,
1533,dio sia lodare,0,4,0.25,1,0,0,0.0078,0.0,0.0,0,0.0,0.0,
1534,vomito,1,2,0.0,2,1,0,-0.0625,0.0,0.0,0,0.0,0.0,
1535,no matteo,0,2,0.5,1,0,0,0,0.0,0.0,0,0,0,
1536,pulizia no polizia,1,2,0.0,2,0,2,0.019,0.0,0.0,0,0.0,0.0,
1537,casa tutto suo ciurma ladrone primadonna,1,12,0.0,2,1,0,0.0,0.0,0.025,1,0.0,0.0,
1538,certamente,0,3,0.0,2,0,2,0.0,0.0,0.0,0,0.0,0.0,
1539,avere dimenticare tasto fastello guardare mio zio magistrato tasto questo nascondere sotto non vedere,1,20,0.0,2,0,2,-0.0056,0.0714,0.0,0,0.0,1.0,
1540,presto ruspa middle_finger ,1,6,0.0,1,0,0,-0.0312,0.0,0.0,0,0.0,0.0,
1541,acidita stomaco loudly_crying_face ,1,5,0.0,3,1,1,-0.1133,0.0,0.0,0,0.0,0.0,
1542,eccovi ciao tutto,0,3,0.6667,2,0,2,0.0,0.3333,0.0,0,0.0,0.0,
1543,no proprio indigesto,1,5,0.2,3,2,0,-0.0781,0.0,0.0,0,-0.1,0.2,
1544,vomitevole,1,1,0.0,2,1,0,0,0.0,0.0,0,0,0,
1545,gli venire piu fragile,0,4,0.0,2,0,1,0.0208,0.5,0.0,0,0.25,0.5,
1546,malpezzi castaldini non parlare meno male manca genio liberare capitano meno male cercare tuo sosia ascoltare quello povero papa stretto cuore mio figlio soffrire deh ora avere anno ancora nonostante cura soffrire matteo sebastiano questo delinquente strada ruspa domenica ballottaggio bolzano,1,61,0.0,1,0,0,-0.0259,0.0244,0.0034,1,-0.2389880952380952,0.39404761904761904,
1547,ormai essere quasi tutto indigesto,1,5,0.0,1,0,0,-0.1042,0.0,0.0,0,0.0,0.0,
1548,bicarbonato ammazzare arpia,1,5,0.0,3,0,3,-0.1673,0.0,0.0,0,0.0,0.0,
1549,protette nuda bello mazza dopo volere vedere chi coraggio avvicinare smiling_face_with_horns  smiling_face_with_horns  angry_face ,1,13,0.0,3,3,0,0.0892,0.2,0.0147,1,0.425,0.7,
1550,no no no ancora no importante faccia come avere dire andare strumentalizzare stesso primo referendum,0,24,0.1667,2,1,0,-0.0416,0.0,0.0,0,0.016666666666666663,0.4861111111111111,
1551,questo essere demente essere gentile,1,7,0.0,2,0,1,-0.125,0.0,0.0278,1,0.6,0.9,
1552,bufala stare italiano piu padrone stesso andare governo,0,20,0.0,1,0,0,0.0573,0.0,0.0,0,0.25,0.25,
1553,digerire tutto questo coglione sinistra iscrivere questo sito allora digerire tutto,1,13,0.0,2,0,1,-0.0109,0.0,0.012,1,0.0,0.0,
1554,essere impossibile insopportabile avere fatto bene fare yoga,1,10,0.0,2,0,1,0.0015,0.0,0.0167,1,0.0,0.0,
1555,questo sinistra ipocrita ladroni questo fare diventare razzista,1,10,0.0,1,0,0,-0.0375,0.125,0.0317,2,0.0,0.0,
1556,domandina questo odiare coso tanto italiano questo fare soldo pure grande solo televisione tutto giorno avere rotto parlare non dire niente questo interessante volere vedere giovane televisioni no questo essere gia ricco data possibilita giovane nuovo fresca idre questo cadavere via televisioni politico fare attore attore fare politico boy chi capire bravo,1,67,0.0,12,9,6,0.0116,0.0769,0.0028,1,0.09194214876033056,0.4549586776859504,
1557,cattivo governo mandare casa,1,7,0.1429,2,0,1,-0.1226,0.0,0.0,0,-0.6999999999999998,0.6666666666666666,
1558,parola sicurezza stare cancellata vocabolo lingua italiano poco stare certo vedere essere ridosso elezione nuovo sindaco tutto dire sacco bella parola avere sacco buono proposito fare sacco promessa non credo piu,1,50,0.02,4,0,8,0.0364,0.0323,0.0,0,0.24983766233766233,0.5633477633477634,
1559,no niente tutto inutile,1,7,0.0,1,0,0,0.125,0.0,0.0,0,-0.5,0.2,
1560,no cosa ridere quello ebete,1,6,0.0,1,0,0,0.2266,0.0,0.037,1,-0.7999999999999999,1.0,
1561,no no no,0,3,0.0,1,0,0,0,0.0,0.0,0,0,0,
1562,votero no,0,4,0.0,2,0,1,0,0.0,0.0,0,0,0,
1563,no,0,2,0.5,1,0,0,0,0.0,0.0,0,0,0,
1564,idem,0,1,0.0,2,1,0,0.0,1.0,0.0,0,0.0,0.125,
1565,pure,0,2,0.0,1,0,0,0,0.0,0.0,0,0,0,
1566,circo parvenu,0,2,1.0,1,0,0,-0.0312,0.5,0.0769,1,0,0,
1567,spiacere debbio avere cambiare canale altrimenti oltre digestione avere rovinare sonno,1,20,0.0,3,2,0,-0.0591,0.0909,0.0,0,0.0,0.0,
1568,avere paura avere paura ora via clandestino subito voto,1,11,0.0,3,2,2,-0.211,0.0,0.0,0,-0.30476190476190473,0.7785714285714286,
1569,attenzione manca tasto piu importante subalvee semina odio,1,10,0.0,2,1,1,0.0326,0.125,0.0,0,0.175,0.6375,
1570,caro renzi tutto suo grande lavoro scegliere avere spazio pensare infermiere ormai vecchio pieno acciacco dovere erogare assistenza avere bisogno parlare esperienza quanto infermiera andare avanti anno sentire proprio peso lavoro volere sapere trovare giusto arrivare fatidico pensione dipendente pubblico dovere aspettare mese liquidazione avere gia versare anno lavorare grazia buon lavoro,0,82,0.0,4,1,6,0.0509,0.0,0.0,0,0.2794642857142857,0.40654761904761905,
1571,forte danno cittadino voto no,0,7,0.1429,1,0,0,-0.0439,0.0,0.0,0,0.4333333333333333,0.7333333333333333,
1572,no indigesto entrambi sembrare vivere altro pianeta,1,9,0.0,3,2,1,0.0703,0.0,0.0,0,0.13636363636363635,0.5,
1573,entrare matteo non potere piu quello gallina,1,10,0.0,1,0,0,-0.0474,0.0,0.0,0,0.0,0.0,
1574,matteo asfaltare questo arpia,1,5,0.0,2,1,1,-0.0833,0.0,0.0,0,0.0,0.0,
1575,bisogna rieducare italiota servizio militare obbligatorio,1,8,0.375,3,1,1,0.1172,0.0,0.0175,1,-0.05,0.55,
1576,scarsa bovini,0,2,0.0,1,0,0,0,1.0,0.0,0,-0.4,0.6,
1577,bastare questo parassita,1,4,0.0,2,1,0,-0.0781,0.0,0.0417,1,0.0,0.5,
1578,no perfettamente ragione proprio non digerire,1,8,0.0,1,0,0,-0.0494,0.0,0.0,0,-0.14285714285714285,0.5357142857142857,
1579,voto no,0,3,0.3333,1,0,0,0.0078,0.0,0.0,0,0.0,0.0,
1580,non potere davvero ascoltare,0,5,0.0,2,1,0,-0.2344,0.0,0.0,0,-0.1,0.2,
1581,chiedere quello povero bambino abusare vostro prete pelofili,1,10,0.0,2,1,1,-0.0645,0.125,0.0,0,-0.4,0.6,
1582,mettere barcone insieme immigrato vedere difendere spada trattare senza vedere popolo italiano questo morire fame,1,26,0.0,1,0,0,-0.0111,0.0,0.0,0,0.0,0.0,
1583,giacomo caves brini primo invocare trans eccovi servire,0,10,0.0,2,0,1,0.0015,0.5,0.0,0,0.25,0.3333333333333333,
1584,non prendere male nessuno fa male mascella quanto questo ridere,0,18,0.0,2,0,2,0.0996,0.0,0.0,0,0.0,0.0,
1585,malpezzi sembrare prendere giro ridere sempre gente crisi ridere,1,17,0.0,4,2,1,-0.0022,0.0,0.0,0,0.3,0.1,
1586,cruccio quando fare intervista salvini massimo fine ecceda,0,12,0.0,2,1,0,0.0045,0.0,0.0,0,0.0,0.0,
1587,politico fare schifo,1,5,0.2,1,0,0,-0.0176,0.0,0.05,1,0.0,0.0,
1588,idem contare,0,3,0.0,3,1,1,-0.0229,0.0,0.0,0,0.0,0.0,
1589,amaro,0,4,0.0,1,0,0,0.5938,0.0,0.0,0,0.5,0.6,
1590,solita balla come insomma,1,6,0.0,2,0,2,0.0469,0.0,0.04,1,-0.25,0.25,
1591,troppo parola tauto schifo bisogna ascendere ruspa,1,6,0.0,4,0,5,0.0,0.2857,0.02,1,0.2,0.2,
1592,certo volta sembrare essere realta corre the walkie decadi solo invece zombie essere amico africano questo punto preferire zombie,1,27,0.0,4,1,4,0.0195,0.1053,0.0,0,0.10357142857142856,0.46785714285714286,
1593,certo bisogna dare mano giovane italiano avere natalita italiano,0,12,0.3333,1,0,0,0.0424,0.0,0.0,0,0.07857142857142857,0.24285714285714285,
1594,sempre coso comunque avere ruspa,1,10,0.1,2,0,1,-0.0755,0.0,0.0,0,0.0,0.0,
1595,vedere commento tastiera non bastare,0,8,0.0,2,1,0,-0.0147,0.0,0.0,0,0.0,0.5,
1596,asfaltare capitano,1,3,0.0,2,1,0,0.0,0.0,0.0,0,0.0,0.0,
1597,bravo salvini sopportare certo cretinata dire bisogna solo usare metodo yoga no essere solo piangere,1,21,0.0,2,0,2,0.0207,-0.0667,0.01,1,-0.01714285714285716,0.7142857142857143,
1598,continuare dire perdere andare casa puo andare subito avanzare fare danno fearful_face ,1,2,0.0,20,0,37,-0.0864,0.0,0.0,0,0.0,0.0,
1599,guardare mettere questo piano peggio era stanche,0,13,0.0,2,1,0,-0.0353,0.1429,0.0,0,-0.4,0.6499999999999999,
1600,buonasera sera salvini sacco cazzata stare dire anno fatto tutto quello pdf ando vivere questo persona,1,22,0.0,21,0,20,0.0292,0.0588,0.0094,1,0.41818181818181815,0.55,
1601,odioso malpezzi vivo altro pianeta castaldini fa parte partito piu ridicolo do italia ed irritante prendere schiaffo ora,1,25,0.0,5,0,7,-0.0031,0.0556,0.0083,1,-0.07166666666666667,0.635,
1602,no,0,1,0.0,2,1,0,0,0.0,0.0,0,0,0,
1603,avere sbagliare roma dovere avere fiducia causando,0,9,0.0,2,0,1,-0.0899,0.1429,0.02,1,0.0,0.0,
1604,caro matteo essere fare compagnia,0,10,0.1,1,0,0,0.1354,0.0,0.0,0,0.0,0.0,
1605,no essere odioso,1,3,0.0,2,1,0,0.3233,0.0,0.0625,1,0.0,0.0,
1606,mentecatto,1,1,0.0,1,0,0,-0.1875,0.0,0.0,0,0.0,0.0,
1607,altro burma,0,3,0.0,2,1,0,0.0,0.5,0.0,0,-0.125,0.375,
1608,castaldini fa girare canale,0,5,0.0,3,1,2,-0.1042,0.0,0.0,0,0.0,0.0,
1609,volere dicare solita schifezza questo governo offrire,1,11,0.0,3,1,2,-0.0068,0.0,0.0,0,-0.525,0.525,
1610,persona intelligente andare votare bus sapere cosa votare come fare persona credere come essere pronto ad appoggiare antina mi su contrapposizione quello pdf rendere conto gravitare suo parola ogni giorno passo vedere luce fondo tunnel affievolire sempre piu,0,61,0.0328,6,2,3,0.0323,0.1316,0.0,0,0.35333333333333333,0.6066666666666667,
1611,stasera vomitare,1,2,0.0,2,0,1,0.0,0.0,0.0625,1,0.0,0.0,
1612,potere dire quello volere pensare essere ebete,1,11,0.0,1,0,0,-0.0383,0.0,0.0217,1,-0.033333333333333326,0.5750000000000001,
1613,come furano ad essere coso cretino,1,6,0.0,2,1,0,0.3125,0.1667,0.0294,1,-0.7999999999999999,1.0,
1614,non digerire nemmeno fernet branca,1,7,0.0,1,0,0,0.0142,0.0,0.0,0,0.0,0.0,
1615,bue amico mio essere topo mondo quello zanzara,0,13,0.0,1,0,0,0.0312,0.25,0.0217,1,0.0,0.0,
1616,pensare dare fastidio quello pdf,0,9,0.0,2,0,1,0.0,0.2,0.0,0,0.0,0.0,
1617,essere teste,1,5,0.0,2,0,1,0.0156,0.0,0.0,0,0.0,0.0,
1618,votero no faro propaganda no fortissime no renzi casa assolutamente,0,20,0.25,6,2,4,-0.067,0.1,0.0,0,0.05,0.5,
1619,lasciare parolaccia sapientone laureato comunista bifolchi ignorante non dovere ripetere,1,13,0.0,5,0,5,-0.0459,0.0,0.0114,1,-0.6,0.8,
1620,tutto zumate coso dire politico,1,8,0.0,3,0,3,0.0004,0.2,0.0,0,0.0,0.1,
1621,essere incompetente,1,3,0.0,1,0,0,-0.2031,0.0,0.0,0,-0.35,0.3666666666666667,
1622,manca librandi completare trio parpagliole ripetere sempre quello avere inculcare pirolo firenze gallina starnazzare,1,23,0.0,2,0,3,-0.0171,0.1429,0.0,0,-0.05,0.225,
1623,filippo fistolosa,0,2,0.0,1,0,0,0.0,0.5,0.0,0,0.0,0.0,
1624,essere andare nascondere,1,4,0.0,2,0,1,-0.0391,0.0,0.0,0,0.0,0.0,
1625,coccode,0,3,0.0,1,0,0,0,1.0,0.0,0,0.0,0.0,
1626,caro matteo dichiaro salvatore lavoratore diversamente fregare popolo priorita immigrazione frutta banca legge fan comodo prendere voto,1,36,0.0,2,0,6,0.007,0.0588,0.0,0,0.2,0.7,
1627,castaldini rompicoglioni non andare zappare patata questo scansafatiche,1,14,0.0,3,1,1,-0.0815,0.0,0.0423,3,0.0,0.0,
1628,purtroppo permettere incazzare disturbato dare fiato al tromba integro rotta,1,18,0.0,1,0,0,-0.0895,0.0,0.0132,1,-0.37500000000000006,0.6749999999999999,
1629,credo media bombardamento negativo non aiuto fare capire come temperatura estivo percepire ed effettivo lasciare influenzare piu percepire,0,27,0.037,4,0,5,-0.0241,0.0,0.0,0,0.26666666666666666,0.5666666666666668,
1630,castaldini nuovo centro destra non pdf,0,10,0.0,2,0,1,0.0585,0.1667,0.0,0,0.10735930735930736,0.3634199134199134,
1631,ripulire votero senso parola,1,9,0.0,3,0,2,0.0966,0.0,0.0,0,0.3666666666666667,0.7000000000000001,
1632,mi no bastare,0,2,0.0,3,0,2,-0.0625,0.3333,0.0,0,0.0,0.5,
1633,sindacato quello dovere difendere lavoratore aho beh questo sapere complice questo governo affonda italia,1,15,0.0667,5,0,7,0.0232,0.0714,0.0,0,-0.1,0.0,
1634,bravo matteo,0,2,0.0,1,0,0,0.3041,0.0,0.0,0,0.7,0.6000000000000001,
1635,no stare palla tutto castaldini fa venire fuori istinto omicidio questo sera avere guardare solo primo parte solito quello pdf nci rifondazione essere grande scassare,1,34,0.0588,4,0,7,0.0142,0.08,0.012,2,0.2,0.5833333333333333,
1636,sei grande thumbs_up  clapping_hands ,0,4,0.0,1,0,0,0.2578,0.0,0.0,0,0.8,0.75,
1637,mandare volentieri mezzo amico musulmano zingaro,1,12,0.0,3,1,1,0.042,0.0,0.0208,1,0.04166666666666667,0.4583333333333333,
1638,non riforma costituzionale titolo coda colpo stare iniziare monte,0,18,0.0,1,0,0,-0.0834,0.0,0.0,0,0.0,0.0,
1639,jacks buon,0,2,0.0,1,0,0,0,1.0,0.0,0,0.7,0.6000000000000001,
1640,no essere indigeribili,1,3,0.0,1,0,0,0.3125,0.0,0.0,0,0.0,0.0,
1641,manca dulie dulie,0,4,0.0,3,2,0,0,0.6667,0.0,0,0,0,
1642,basso qualita impossibile digerire molto spesso fa pure cagare,1,13,0.0769,1,0,0,-0.1059,0.0,0.0161,1,-0.16666666666666666,0.6000000000000001,
1643,fuori europa altrimenti italia crepa contare solo questo,0,11,0.0,2,1,2,0.0476,0.0,0.0,0,0.0,0.0,
1644,no stare indigesto,0,4,0.0,1,0,0,0.3125,0.0,0.0,0,0.0,0.0,
1645,non sopportare,1,3,0.0,2,0,1,-0.004,0.0,0.0,0,0.0,0.0,
1646,questo divertente gazzetta parma oggi andare scrocco bus quando controllore fermare fornire generalita coetaneo vedere recapitare multa ragazzino origine albanese anno stare denunciare carabiniere sostituzione persona ftalo attestazione proprio identita,1,56,0.0,4,0,4,0.0172,0.0,0.0,0,0.3466666666666667,0.7,
1647,senso ricominciare studio capo capire piu,0,12,0.0,2,1,0,0.0893,0.0,0.0,0,0.5,0.5,
1648,no tanto capitano gia danno fastidio,1,6,0.0,3,0,3,0.0404,0.0,0.0,0,0.2,0.2,
1649,venire vomito fare ribrezzo,1,6,0.0,4,1,2,-0.0078,0.0,0.037,1,0.0,0.0,
1650,no,0,1,1.0,1,0,0,0,0.0,0.0,0,0,0,
1651,no centro sociale,0,4,0.0,1,0,0,-0.0029,0.0,0.0,0,-0.058333333333333334,0.08333333333333334,
1652,allucinante malpezzi inaccettabile castaldini,1,7,0.0,2,0,2,-0.0469,0.0,0.0,0,-0.25,1.0,
1653,avere tutto paura,0,5,0.0,3,0,4,0.0,0.0,0.0,0,0.0,0.0,
1654,dio fa poi accoppiare,0,7,0.0,2,0,1,-0.0391,0.0,0.0,0,0.0,0.0,
1655,marco essere potere fare culo volere non togliere essere ignorante dovere essere stupido ed cieco cretino non vedere culo questo passare italia contro italiano,1,34,0.0,2,1,3,-0.0294,0.0833,0.0252,4,-0.32,0.6183333333333334,
1656,essere fuori testa questo,1,7,0.8571,2,1,0,-0.0234,0.0,0.0,0,0.0,0.0,
1657,martingala mutano,0,3,0.0,2,1,0,0,1.0,0.0,0,0.0,0.0,
1658,voto no,0,3,0.0,1,0,0,0.0078,0.0,0.0,0,0.0,0.0,
1659,deluso ennesimo buca umbertine cominciare pensare sei uguale altro,0,14,0.0,2,0,1,-0.0044,0.1111,0.0,0,-0.375,0.4375,
1660,cazzata come sempre contare cosa serie,1,10,0.0,2,0,1,-0.0662,0.0,0.0,0,0.0,0.0,
1661,essere donnina quattro soldo fare solo marchetta renzi,1,11,0.0,1,0,0,0.0,0.0,0.0185,1,-0.09375,0.75,
1662,mettere pulire cesso poi buttare dentro tirare sciacquone sprangare porta,1,18,0.0,1,0,0,0.0275,0.0,0.0,0,0.10000000000000002,0.23333333333333336,
1663,meno male,0,2,0.0,2,0,1,0.0078,0.0,0.0,0,0.0,0.0,
1664,buono serata bello gente,0,5,0.0,4,0,3,0.3395,0.0,0.0,0,0.6499999999999999,0.8,
1665,assolutamente no,0,2,0.0,2,0,1,0.375,0.0,0.0,0,-0.1,0.9,
1666,essere mio storia,0,8,1.0,1,0,0,-0.0059,0.0,0.0,0,0.0,0.0,
1667,magari non essere bambino violentare,0,5,0.0,2,1,0,-0.0104,0.0,0.0,0,0.0,0.0,
1668,non digerire forza salvini,1,4,0.0,3,1,2,0.0166,-0.25,0.0,0,0.0,0.0,
1669,stasera avere pure ciclo,1,5,0.0,1,0,0,0.0,0.0,0.0,0,0.0,0.0,
1670,ribellare bloccare tutto,1,2,0.0,2,0,2,-0.0625,0.0,0.0,0,0.0,0.0,
1671,conservatore,0,4,0.0,2,1,1,0.0,0.0,0.0,0,0.0,0.0,
1672,matteo salvini essere tutto,0,6,0.0,1,0,0,0.0,-0.25,0.0,0,0.0,0.0,
1673,lasciare perdere quello volere marcare fare smettere ridere,0,10,0.0,3,0,3,0.0084,0.0,0.0,0,0.0,0.0,
1674,avere prendere primo gastroprotezione,0,5,0.0,2,1,0,0.0169,0.25,0.0,0,0.25,0.3333333333333333,
1675,andare molise,0,3,1.0,1,0,0,0.0625,0.0,0.0,0,0.0,0.0,
1676,governante persona inutile ladro,1,5,0.0,2,0,1,-0.0625,0.0,0.0312,1,-0.5,0.2,
1677,idem,0,1,0.0,1,0,0,0,0.0,0.0,0,0.0,0.125,
1678,no no no,0,3,0.0,1,0,0,0,0.0,0.0,0,0,0,
1679,meno hotel gratis immigrato piu asilo gratis bambino italiano,1,14,0.0,1,0,0,0.0312,0.0,0.0,0,0.22666666666666666,0.4333333333333334,
1680,voto no,0,3,0.3333,1,0,0,0.0078,0.0,0.0,0,0.0,0.0,
1681,essere persona non riuscire trovare discorso fatto accaduto ragazza,0,15,0.0,2,0,2,-0.0029,0.0,0.0,0,0.0,0.0,
1682,impossibile,0,1,0.0,2,0,1,-0.2969,0.0,0.0,0,-0.6666666666666666,1.0,
1683,insopportabile entrambi,1,3,0.0,2,1,0,-0.3125,0.0,0.0,0,0.0,0.0,
1684,aspetto matteo,0,3,0.0,1,0,0,0.001,0.0,0.0,0,0.0,0.0,
1685,sondaggio fatto immaginare pubblico geomio sdrucivano,0,9,0.0,2,0,1,-0.0781,0.3333,0.0,0,0.0,0.06666666666666667,
1686,no,0,2,0.5,1,0,3,0,0.0,0.0,0,0,0,
1687,bello mitragliatrice,1,4,0.0,2,0,1,0.375,0.0,0.0,0,0.6,1.0,
1688,vomito,1,2,0.0,1,0,0,-0.0625,0.0,0.0,0,0.0,0.0,
1689,terrorismo combattere collare cultura city reni,0,8,0.0,2,0,1,0.0129,0.3333,0.0,0,0.0,0.0,
1690,sinceramente tempo chiedere essere fare pensata,0,14,0.0,2,1,1,0.016,0.0,0.0,0,0.5,0.5,
1691,no essere peggio pesce dopo giorno,1,8,0.0,3,2,0,0.1461,0.0,0.0,0,0.2,0.6,
1692,do notizia assolutamente no,0,6,0.0,2,0,1,0.0999,0.0,0.0,0,-0.1,0.9,
1693,alessandro lista face_with_tears_of_joy  face_with_tears_of_joy  face_with_tears_of_joy ,0,5,0.0,1,0,0,0.0,0.5,0.0,0,0.0,0.0,
1694,amo questo uomo qui,0,5,0.0,2,1,0,0.2979,0.0,0.0,0,0.5,0.6,
1695,essere limbo solo salva,0,7,0.0,2,0,1,0.0391,0.0,0.0,0,0.0,1.0,
1696,mica tanto,0,2,0.0,2,0,1,0,0.0,0.0,0,0.0,0.0,
1697,mediatore culturale roma salvini spiegare chi questo rimandare casa non al trasmissione,1,17,0.0,3,2,0,0.0156,0.0,0.0115,1,0.1,0.1,
1698,detta suo italiano questo fuori problema jobber acta,0,11,0.0909,1,0,0,-0.0268,0.25,0.0,0,0.0,0.0,
1699,bravo renzi fare come gianni morandi puo dare piu no fermare mai saluto,0,16,0.6875,1,0,0,0.0885,0.0,0.0,0,0.6,0.55,
1700,no questo volta passo,0,5,0.0,3,2,0,-0.0529,0.0,0.0,0,0.0,0.0,
1701,andare mandata pulire stalla quello essere lavoro,1,12,0.0,3,2,0,-0.0073,0.0,0.0,0,0.3666666666666667,0.7000000000000001,
1702,votare no votare tutto mandare casa,0,7,0.0,6,2,4,-0.0008,0.0,0.0,0,0.0,0.0,
1703,digerire quello appurate para non divano italia quello non digerire nemmeno damigiana burischio,1,22,0.0,3,8,2,0.0094,0.1538,0.0,0,0.0,0.0,
1704, grinning_face ,0,2,0.0,2,1,0,0,0,0,0,0,
1705,normale intendere quello accadere vita tutto giorno allora no gente non fa solitamente questo cosa pubblico gente questo cosa fa solo casa solo amico piu intimo zanzara questo grande famiglia cui vivo soprattutto ridere esasperazione forzatura grottesco raschiare fondo zanzara vita reale vita come dovere invece pudore tabu soprattutto retaggio mondo infettare chiesa non potra mai essere,0,96,0.0104,9,0,17,0.0048,0.0,0.0026,1,0.11152597402597401,0.5494047619047618,
1706,non sopportare proprio,1,5,0.0,1,0,0,-0.004,0.0,0.0,0,0.0,0.0,
1707,no proprio,0,3,0.0,1,0,0,-0.2678,0.0,0.0,0,-0.14285714285714285,0.5357142857142857,
1708,lasciata parlare ognuno qualifica proprio comportamento telespettatore sapere giudicare,0,14,0.0,2,0,1,0.0916,0.0,0.0,0,0.6,1.0,
1709,essere inalata,0,3,0.0,1,0,0,-0.2656,0.5,0.0,0,0.0,0.0,
1710,avere fatto stare valutare avere proposta etc etc etc ruspa,1,14,0.0,3,1,1,0.0,0.3,0.0,0,0.0,0.0,
1711,vivo puro,0,4,0.0,1,0,0,0.0,0.5,0.0,0,0.15714285714285714,0.45,
1712,renzi dittatore naturalmente voto no speranza andare casa,0,17,0.0,4,0,3,-0.0293,0.0,0.0,0,0.1,0.4,
1713,vedere venuta lorica,1,6,0.1667,2,0,1,0.0064,0.6667,0.0,0,0.0,0.0,
1714,presente capitano,0,2,0.0,1,0,0,-0.0312,0.0,0.0,0,0.0,0.0,
1715,caro presidente matteo renzi,0,5,0.0,1,0,0,0.1016,0.0,0.0,0,0.0,0.0,
1716,molto faticosamente,0,2,0.0,2,0,1,-0.0625,0.0,0.0,0,-0.9099999999999999,1.0,
1717,donna estremamente pericoloso evitare assolutamente,1,7,0.0,3,1,1,0.0211,0.0,0.0,0,-0.19999999999999998,0.9,
1718,imbroglioni coso bene credere stesso,1,8,0.0,1,0,1,0.3529,0.2,0.0,0,0.0,0.0,
1719,parassita gente volere vivere legalmente,1,7,0.0,2,1,0,0.0012,0.0,0.0,0,0.16818181818181818,0.35,
1720,massimo cristiano,0,3,0.0,2,0,1,0.1094,0.0,0.0,0,0.0,0.0,
1721,alberto tebaldi,0,2,0.0,1,0,0,0,0.0,0.0,0,0,0,
1722,essere non puo sentire parte roma si re sinistra dare sempre ragione delinquente proprio impossibile arrabbiare tutto sera,1,25,0.0,2,0,4,-0.0115,0.1111,0.0164,2,-0.22023809523809523,0.6339285714285714,
1723,provare capitano grazia dio sei arrivare,0,8,0.0,3,0,2,0.082,0.0,0.0,0,0.0,0.0,
1724,voto no questo riforma eliminare democrazia diro suo partito sara legge,0,18,0.0556,2,1,0,-0.0095,0.0,0.0,0,0.0,0.0,
1725,trasmissione debbio dovere essere pulmistici competete scusa ragione debbio non ce essere,0,19,0.0,2,0,1,0.022,0.3333,0.0,0,-0.05,0.05,
1726,nuda denuncia no,1,4,0.75,2,4,1,-0.2695,0.3333,0.0,0,-0.15,0.30000000000000004,
1727,jacobiano greco,0,2,0.0,1,0,0,0.0,0.5,0.0,0,0.0,0.0,
1728,odioso non parlare poi inutile castaldini,1,7,0.0,3,0,2,-0.0808,0.0,0.0,0,0.0,0.0,
1729,,0,1,0.0,1,0,0,0,0,0,0,0,
1730,pazzesco,0,1,0.0,2,0,1,-0.2227,0.0,0.0,0,-0.6,0.9,
1731,no ormai non credo piu buon centro destra vecchio stampo,0,11,0.0,3,0,2,-0.155,0.0,0.0,0,0.2464285714285714,0.35892857142857143,
1732,pessimo entrambi stop,1,4,0.0,2,0,1,-0.2468,0.0,0.0,0,-0.6999999999999998,0.6666666666666666,
1733,bravo matteo fare qualcosa,0,5,0.0,1,0,0,0.2027,0.0,0.0,0,0.7,0.6000000000000001,
1734,votato no no,0,3,0.0,1,0,0,0.0078,0.0,0.0,0,0.0,0.0,
1735,volere bene matteo,0,4,0.0,2,0,1,0.2969,0.0,0.0,0,0.5,0.6,
1736,accoppiata vivente essere come dolce eccessiva prendere sera cagare mattina,0,15,0.0,4,0,4,0.0118,0.2,0.0133,1,-0.03333333333333335,0.8166666666666668,
1737,carino czarde czarde,0,4,0.0,1,0,0,0.4062,0.75,0.0,0,0.5,1.0,
1738,buono solo cosa solo volta poi chiamare masochismo maniacale,1,15,0.0667,2,0,2,0.1274,0.0,0.0,0,0.2333333333333333,0.8666666666666667,
1739,dimensione paradosso collocare esattamente dove ognuno volere sia,0,15,0.0667,1,0,0,0.0436,0.0,0.0,0,0.225,0.175,
