1,votero no renzi dovere andare casa smiling_face_with_heart-eyes  smiling_face_with_heart-eyes  crying_face ,0,7,0.0,1,0,0,0.0,0.0,0.0,0,0.0,0.0,
2,poi sentire fiera eh face_with_tears_of_joy ,0,5,0.0,1,0,0,0.0716,0.0,0.0,0,0.8,1.0,
3,bello,0,1,0.0,1,0,0,0.5312,0.0,0.0,0,0.85,1.0,
4,arrusi,0,1,0.0,1,0,0,-0.375,1.0,0.0,0,0.0,0.0,
5,essere indigesto fare venire colica intestinale,1,8,0.0,2,0,2,-0.2083,0.0,0.0,0,0.0,0.0,
6,grande sondaggio zanzara,0,6,0.5,1,0,0,0.0859,0.0,0.0417,1,0.8,0.75,
7,malpezzi quando avere dire attenuante culturale shock totale,0,8,0.875,2,0,2,-0.0707,0.0,0.0,0,0.05,0.425,
8,votero no no no,0,6,0.6667,1,0,0,0.0,0.0,0.0,0,0.0,0.0,
9,avere cambiare canale pdf nci fare schifo,1,11,0.0,2,0,2,-0.0066,0.2857,0.0244,1,0.0,0.0,
10,votero avere approvare legge parlamentare crisi fine legislatura poverino dopo tutto miniera scavato volere proprio,1,26,0.0,3,2,0,0.0,0.0,0.0,0,0.09999999999999998,0.8,
11,vergognoso,1,1,0.0,1,0,0,-0.3125,0.0,0.0,0,0.0,0.0,
12,volere poliziotto ogni bus controllore treno scortare,0,13,0.0,3,0,3,-0.0046,0.0,0.0,0,0.0,0.0,
13,sapere sara molto difficile introdurre flessibilita uscita sessantenne essere sicuro riuscire costo mettere fiducia aiutare aiutare matteo renzi promessa,0,35,0.0,2,0,2,-0.0036,0.0,0.0,0,-0.07500000000000001,0.9444444444444444,
14,non sentire mancanza giornalista,0,8,0.0,1,0,0,0.1243,0.0,0.0,0,0.0,0.0,
15,idem thumbs_up_light_skin_tone ,0,2,0.0,1,0,0,0,0.0,0.0,0,0.0,0.125,
16,povero donna renzi non capire niente,1,10,0.0,3,0,2,-0.1293,0.0,0.0,0,-0.4,0.6,
17,mio moglie augurare,0,4,0.0,2,0,1,0.1367,0.0,0.0,0,0.0,0.0,
18,cambiare criterio graduatoria modo nido andare proditoriamente bambino entrambi genitore lavorare,0,21,0.0476,2,0,2,0.0109,0.0,0.0,0,0.0,0.0,
19,parlare lavoro,0,3,0.0,1,0,0,0.0039,0.0,0.0,0,0.0,0.0,
20,questo cacchio malpezzi quando parlare quello mezzo sorriso ebete fa venire nervo quanto odio questo rincoglionire tutto babbioni pensare uguale,1,34,0.0,3,1,1,-0.0473,0.0,0.0278,4,-0.16666666666666666,0.375,
21,babbea,0,1,0.0,1,0,0,-0.0312,1.0,0.0,0,0.0,0.0,
22,marella colombo,0,2,0.0,1,0,0,0,0.5,0.0,0,0,0,
23,no assoluto dovere andare zappare,1,7,0.1429,2,1,0,-0.0742,0.0,0.0,0,-0.1,0.9,
24,yemenita intui,0,2,0.0,1,0,0,0,1.0,0.0,0,0.0,0.0,
25,non sopportare invitare sempre tivu casa dovere stare,1,17,0.0,3,2,1,-0.0069,0.125,0.0,0,0.0,0.0,
26,alfano avere riportare solo giorno tempo voto guardare caso renzi socio ha promesso proprio ora triplicare bonus bebe chiaramente non andare nato baro tale restera giocare pulito impossibile,0,38,0.0,8,0,11,0.0236,0.0357,0.0,0,-0.010714285714285713,0.6865079365079364,
27,andare renzo sei grande,0,4,0.0,4,0,3,0.0859,0.0,0.0,0,0.8,0.75,
28,andare capitano andare,0,3,0.0,1,0,0,0.0625,0.0,0.0,0,0.0,0.0,
29,tautomero altro,0,7,0.0,1,0,0,0.0,0.5,0.0,0,-0.125,0.375,
30,non capire debbio faccia partecipare sempre trasmissione quando vedere cambio canale credo essere molto non vedere trasmissione,0,26,0.0,3,0,3,-0.0128,0.0588,0.0,0,0.0,0.0,
31,nuovo avanzare donna inutile,1,7,0.0,1,0,0,0.0161,0.0,0.0,0,-0.18181818181818182,0.32727272727272727,
32,no andare traverso,1,5,0.0,1,0,0,-0.0,0.0,0.0,0,0.0,0.0,
33,finta assunzione,0,3,0.0,1,0,0,-0.3145,0.0,0.0,0,-0.5,1.0,
34,essere pagare fare scena,0,6,0.0,2,1,0,0.0146,0.0,0.0,0,0.0,0.0,
35,chi avere votato cosa pensare,0,9,0.0,1,0,0,0.0184,0.0,0.0,0,0.0,0.0,
36,matteo servo colpo stare qua poco dovere andare giro tutto armato come america,1,18,0.0,3,0,2,-0.0332,0.0,0.0,0,-0.1875,0.5,
37,non potere vedere cartolina dovere vergone stare quello studio,1,16,0.0,2,0,2,0.0889,0.1111,0.0,0,0.5,0.625,
38,essere arrivare punto non ritorno povero,0,10,0.1,3,1,1,0.114,0.0,0.0,0,-0.4,0.6,
39,malpezzi pure convincere,0,5,0.0,1,0,0,-0.0117,0.0,0.0,0,0.0,0.0,
40,pubblicita andare mandare cagare,1,5,0.0,2,0,2,-0.061,0.0,0.0312,1,-0.2,0.8,
41,sperare liberare presto questo gente chissa essere costringere ad emigrare,1,15,0.0,2,0,2,0.0845,0.0,0.0,0,0.04999999999999999,0.5,
42,no niente fare cargo re face_with_tears_of_joy ,1,6,0.0,4,1,4,0.0,0.2,0.0,0,0.0,0.0,
43,si referendum avanti tutto grande presidente,0,10,0.0,1,0,2,0.1016,0.0,0.0,0,0.8,0.75,
44,zeus incazzare,0,5,0.2,1,0,0,-0.1562,0.0,0.0714,1,0.0,0.0,
45,voto no,0,3,0.3333,1,0,0,0.0078,0.0,0.0,0,0.0,0.0,
46,malpezzi volere fare credere esistere babbo natale castaldini appartenere partito fantasma,0,17,0.0,1,0,0,0.0298,0.0,0.0,0,0.0,0.0,
47,salvo chi puo,0,4,0.0,2,1,0,0,0.0,0.0,0,0.0,0.0,
48,salvini favore dicare malpezzi castaldini lasciare tiro favore,1,17,0.0,2,0,1,-0.0059,-0.125,0.0,0,-0.8749999999999998,0.6666666666666666,
49,ciao castaldini essere,0,6,0.6667,3,2,0,0,0.0,0.0,0,0,0,
50,non guardo,0,3,0.0,2,1,0,-0.167,0.0,0.0,0,0.0,0.0,
51,stronzo maltagliate detestare,1,5,0.6,2,0,1,-0.2396,0.3333,0.0,0,0,0,
52,venire vomito,1,4,0.0,1,0,0,-0.0156,0.0,0.0769,1,0.0,0.0,
53,matteo parola danno no tappa bocca quello gallina favore non puo sentire chiedere favore virgolettando figlia cambiare disco,1,34,0.0,4,1,3,-0.0378,0.0556,0.0,0,0.0,0.0,
54,presidente consiglio volta,0,5,0.0,3,0,2,0.0,0.0,0.0,0,0.0,0.0,
55,questo momento kirman foderero ragliare dovere mettere museo rimanere fermo anno,1,19,0.0,3,1,2,-0.0226,0.1818,0.0125,1,0.0,0.0,
56,votero doppio no no,0,5,0.0,1,0,0,0.0991,0.0,0.0,0,0.0,0.0,
57,sara duro,0,2,0.0,2,2,0,-0.0254,0.3333,0.0,0,-0.2916666666666667,0.5416666666666666,
58,notizia molto brutto matteo renzi,0,7,0.0,1,0,0,-0.1187,0.0,0.0303,1,-0.9099999999999998,0.8666666666666667,
59,voto no,0,2,0.0,1,0,0,0.0078,0.0,0.0,0,0.0,0.0,
60,parlare furetto,0,3,0.0,1,0,0,0.0,0.5,0.0,0,0.0,0.0,
61,vedere dio esistere grinning_face_with_smiling_eyes ,0,5,0.0,2,1,2,0.0221,0.0,0.0,0,0.0,0.0,
62,mirto kibbuz capobranco,0,3,0.0,1,0,0,0,1.0,0.0,0,0.0,0.0,
63,prendere buttare cassonetto pattume questo massa di stupido pappone disonesto,1,14,0.0,1,0,0,-0.096,0.0,0.026,2,-0.5499999999999999,0.75,
64,entrambi insopportabile,1,5,0.0,4,0,3,-0.3125,0.0,0.0435,1,0.0,0.0,
65,manca piperno avere fatto filotto,0,7,0.0,2,0,1,0.0147,0.2,0.0,0,0.0,0.0,
66,matrimonio,1,3,0.3333,2,1,0,0.0234,0.0,0.0,0,0.0,0.0,
67,veramente duro sopportare non essere solo librandi non meno salvini forza,1,17,0.1176,1,0,0,-0.0764,-0.0909,0.0,0,-0.06944444444444446,0.5361111111111111,
68,essere specchio reale politicita soldo italiano,1,10,1.0,1,0,0,0.0173,0.1667,0.0,0,0.1,0.15000000000000002,
69,mazzata primo genitore questo non avere abbastanza parolaccia definire,1,12,0.0,2,0,1,-0.0306,0.0,0.0,0,0.125,0.41666666666666663,
70,cambio canale voce fastidio,1,8,0.0,1,0,1,-0.0635,0.0,0.0,0,0.0,0.0,
71,risapere ormai centro sociale rosso sotto scusa byronismo essere sciacallo essere manodopera violento trafficante droga essere umano,1,28,0.0357,2,0,1,-0.03,0.0588,0.0227,3,-0.17333333333333334,0.25333333333333335,
72,voto matteo salvini nicola fagiolo,0,7,0.0,1,0,0,0.0125,0.0,0.0,0,0.0,0.0,
73,voto no questo mio capitano piddini sfigato andare,1,12,0.0833,3,2,0,0.0469,0.0,0.02,1,0.0,0.0,
74,faccia bronzo come sei delicato oggi,0,7,0.7143,3,2,0,0.0535,0.0,0.0,0,-0.3,0.9,
75,aspetto forza matteo salvare questo schifo,1,11,0.0,2,1,0,-0.0034,0.0,0.0238,1,-1.0,1.0,
76,castaldini avere voto condominio parlare nome chi,0,13,0.0,2,1,0,0.0218,0.0,0.0,0,0.0,0.0,
77,questo giornale minchia,1,6,0.0,2,1,0,-0.0859,0.0,0.0435,1,0.0,0.0,
78,zanzara ascoltare gusto quando parlare fluff adesso parlare fluff impegnare ascolto come ascoltare notturno copino,0,27,0.0,3,0,2,-0.0026,0.2,0.0,0,-0.1,0.3,
79,salvini fatto sentire piu,0,5,0.0,1,0,0,-0.0117,-0.25,0.0,0,0.5,0.5,
80,questo aspettare matteo,0,5,0.0,1,0,0,0.0,0.0,0.0,0,0.0,0.0,
81,prego asfaltare starnazzare malpezzi castaldini,1,10,0.0,1,0,0,0.0,0.0,0.0,0,0.0,0.0,
82,assolutamente no,0,2,0.5,1,0,0,0.375,0.0,0.0,0,-0.1,0.9,
83,no sembrare scemo,1,5,0.0,2,0,1,0.2344,0.0,0.0588,1,-0.7999999999999999,1.0,
84,tutto reale tranne parvenze conta come psichiche briscola fiore,1,16,0.0625,3,2,0,-0.0053,0.2222,0.0,0,0.2,0.30000000000000004,
85,questo avere chiuso trasmissione virus vigliacco,1,10,0.0,2,0,1,-0.0683,0.0,0.0208,1,-0.1277777777777778,0.19444444444444448,
86,matteo sei grande,0,4,0.0,1,0,0,0.1289,0.0,0.0,0,0.8,0.75,
87,fare nervoso grimacing_face ,1,6,0.0,2,0,1,-0.0898,0.0,0.0,0,0.0,0.0,
88,voto no augurare dimettere,0,9,0.0,3,0,2,0.1016,0.0,0.0,0,0.0,0.0,
89,dovere avere stomaco ferro non rimettere,1,9,0.0,1,0,0,-0.0417,0.0,0.0,0,0.0,0.0,
90,come voto no dovere buttare fuori sacco pappone fare cadere quello dannata poltrona votare,1,21,0.0,2,1,0,0.0164,0.0,0.0,0,0.0,0.0,
91,avere capire teppisti drogato figlio po,1,8,0.0,3,1,1,0.0508,0.3333,0.0256,1,0.0,0.0,
92,volere saluto quello coppia stare derubare bar quinta colonna castaldini malpezzi andare andare,1,23,0.0,4,1,2,-0.0441,0.0,0.0,0,0.0,0.0,
93,pronto rubare pane italiano,1,8,0.0,2,1,0,-0.0469,0.0,0.037,1,0.1,0.25,
94,non vedere,0,4,0.0,1,0,0,-0.0193,0.0,0.0,0,0.0,0.0,
95,chi puo digerire coso,1,6,0.0,1,0,0,-0.0176,0.0,0.0,0,0.0,0.0,
96,certo,0,1,0.0,1,0,0,0.0,0.0,0.0,0,0.0,0.0,
97,matteo parola parola parola soltanto canzone mina anno fatto matteo parole non andare nessuna parte,0,23,0.0,1,0,0,0.0,0.1333,0.0,0,0.0,1.0,
98,fare tacere sinistra quello dire avere fatto tutto non puo sentire tutto puttanata dire stare portare rovina vapore matteo falla tacere fa venire crampo stomaco nervoso,1,39,0.0,3,0,3,-0.0311,0.0385,0.0119,2,0.0,0.3333333333333333,
99,cuscini non avere creato cazzo avere lasciare merda venire galla come normale sia,1,19,0.0,4,0,3,0.0156,0.0769,0.0123,1,-0.016666666666666673,0.5166666666666666,
100,condividere solo quello cannabismo scopo terapeutico,0,8,0.0,1,0,0,0.1055,0.1667,0.0,0,0.0,1.0,
101,cambio canale,0,3,0.0,2,1,0,0.0017,0.0,0.0,0,0.0,0.0,
102,grande politico,0,4,0.0,2,0,1,0.1289,0.0,0.0,0,0.8,0.75,
103,renzi bugiardo nato perdera pensare proprio non dimettersi volta ed gabbana patentato,1,18,0.0,4,0,4,-0.0172,0.0833,0.0118,1,-0.3,0.1,
104,,0,1,0.0,1,0,0,0,0,0,0,0,
105,vincere no augurare pensata ce levare palla scemo non credo parola molla tutto,1,23,0.0,2,1,2,-0.0261,0.0,0.0256,2,0.0,0.6000000000000001,
106,referendum presentera votante votera ciao,0,16,0.0,3,0,2,-0.0125,0.0,0.0,0,0.0,0.0,
107,essere stupidire intollerante,1,6,0.0,2,1,0,-0.3828,0.0,0.0345,1,-0.7999999999999999,1.0,
108,matteo bastonata quello favore thumbs_up ,1,10,0.0,1,0,0,0.0807,0.0,0.0,0,0.0,0.0,
109,insopportabile,1,1,0.0,2,1,0,-0.3125,0.0,0.0,0,0.0,0.0,
110,avere hacker profilo avere fatto post senza nessuna questo parola moreni motorini menzognero menomati motoruspa,1,24,0.0,3,1,1,-0.0224,0.4,0.009,1,0.0,0.0,
111,chiedere rendere conto quello dire quello sorrisetto volere convincere governo questo fare proporre non vergone presentare tivu credere essere tutto rimbambito,1,39,0.0256,5,3,2,0.0239,0.0952,0.0063,1,0.0,0.0,
112,mai sentito nominare,0,3,0.0,1,0,0,-0.2031,0.0,0.0,0,0.0,0.0,
113,zotico,1,1,0.0,2,1,0,0,0.0,0.0,0,0,0,
114,ascoltero votero piacere matteo salvini vedere domani caserta,0,12,0.0,2,0,1,0.0312,-0.125,0.0,0,0.0,0.0,
115,andrea turlupina trovare sempre spazio milan,0,11,0.0,1,0,0,-0.0044,0.1667,0.0,0,0.0,0.0,
116,solo stare aspettare matteo altrimenti no non digerire affatto,0,11,0.0909,3,1,3,0.0156,0.0,0.0,0,0.0,0.0,
117,nessuna fortuna non essere rivoluzionario patriota,0,13,0.0,3,0,3,-0.0573,0.0,0.0,0,0.0,0.0,
118,transumi mio no assicurato,0,6,0.1667,2,0,1,-0.2812,0.25,0.0,0,0.0,0.0,
119,avere dovere girare piazza pulito,0,6,0.0,1,0,0,0.0823,0.0,0.0,0,0.3666666666666667,0.7000000000000001,
120,si renzi cominciare fischiare orecchio come treno leopoldo questo cerca voltare frittata poveretto,1,21,0.0,4,2,3,-0.0179,0.1538,0.0102,1,-0.25,0.5,
121,ovviamente votero no,0,5,0.4,1,0,0,0.1289,0.0,0.0,0,0.0,0.5,
122,voto no puo dire quello volere essere italiano decidere smiling_face_with_sunglasses ,0,15,0.0,3,0,3,-0.009,0.0,0.0,0,0.0,0.0,
123,sapere tutto quest news sfogo cambiare nulla si renzi magari aiutare fare qualche risata piu bastare viso pancia essere pieno poi resto nulla fortuna dovere lavorare popolo invece lavorata solo viso tasca grazia,1,49,0.0816,5,0,4,0.0077,0.1515,0.0,0,0.22499999999999998,0.5416666666666666,
124,andare vaffa,1,5,0.0,2,0,1,0.0625,0.5,0.0,0,0.0,0.0,
125,lavoro fare vedere bene come bella baldracca casino,1,14,0.0,2,1,0,0.0791,0.0,0.0392,2,0.85,1.0,
126,assolutamente no,0,2,0.0,2,1,0,0.375,0.0,0.0,0,-0.1,0.9,
127,solcavate rappresentante governo non sapere piu pesce pigliare continuare dire avere risolvere tutto angry_face ,1,20,0.0,1,0,0,0.0109,0.0769,0.0,0,0.5,0.5,
128,avere vedere puntata odioso,1,6,0.0,2,1,0,-0.1013,0.0,0.037,1,0.0,0.0,
129,non essere male vedere nido costa quanto rata mutuo piu,0,16,0.0,2,1,0,0.0729,0.0,0.0,0,-0.24999999999999992,0.43333333333333335,
130,credo essere tanto votare no grande come casa,0,11,0.0909,2,0,1,0.0043,0.0,0.0,0,0.0,0.1,
131,andare matteo fare vedere,0,4,0.0,1,0,0,-0.0678,0.0,0.0,0,-0.6,0.9,
132,tutto quanto votare no sparire tutto quello pdf,1,10,0.4,1,0,0,0.0801,0.125,0.0,0,0.0,0.0,
133,ieri domenica indimenticabile avere incontrare al ad urgevano ed serata famiglia ad alma seguiro poco speranza grinning_face_with_big_eyes ,0,29,0.0345,1,0,2,-0.0279,0.0625,0.0,0,0.30625,0.75,
134,dovere ritornare amare patria,1,6,0.0,1,0,0,0.1979,0.0,0.0,0,0.25,0.3,
135,mancare solo boldrini ed essere apporre mandare qualche campo roma essere tutto brava gente smiling_face_with_horns ,1,18,0.0,2,1,0,0.044,0.0714,0.011,1,0.35,0.8,
136,non potere capitare peggio,1,7,0.0,2,1,0,0.2008,0.0,0.0,0,-0.4,0.6,
137,ridiate maro,0,3,1.0,1,0,0,-0.0547,0.5,0.0,0,0.0,0.0,
138,voto no renzi casa,0,7,0.0,2,0,2,0.0202,0.0,0.0,0,0.0,0.0,
139,non mondo reale mondo libero inibizione proprio questo non mondo reale mondo votero,0,23,0.0435,3,2,2,-0.0187,0.0,0.0,0,0.06666666666666668,0.46666666666666673,
140,parlare singolare italiano essere grado decidere sole,0,12,0.0,3,3,3,0.0234,0.0,0.0,0,0.25,0.3125,
141,centro sociale covo delinquente figlio papa solo ruspa,1,12,0.0833,3,2,0,-0.0081,0.0,0.0185,1,-0.022222222222222227,0.3888888888888889,
142,rutile,0,2,0.0,2,1,0,0,1.0,0.0,0,0,0,
143,volere italia milione matteo salvini,0,8,0.0,1,0,2,-0.026,-0.2,0.0,0,0.0,0.0,
144,meno mono non sopportare proprio questo creatina angry_face ,1,12,0.0,1,0,1,-0.0222,0.1429,0.0,0,-0.16666666666666666,0.06666666666666667,
145,gutta uscire subito,1,4,0.0,1,0,0,-0.0729,0.3333,0.0,0,0.0,0.0,
146,tutto mesi ad persona presidente cozza persona avere italia,1,13,0.0,2,0,1,0.0,0.2222,0.0,0,0.0,0.0,
147,andare matteo falla nero essere ciarlatane raccontare montagna menzogna,1,11,0.0,2,1,2,-0.039,0.0,0.0282,2,-0.16666666666666666,0.43333333333333335,
148,buono sera tutto nuovo iscritto,0,5,0.0,3,2,3,0.2052,0.0,0.0,0,0.41818181818181815,0.5272727272727273,
149,essere capitano,0,4,0.0,1,0,0,0.0,0.0,0.0,0,0.0,0.0,
150,no grande quanto casa,0,6,0.1667,2,0,1,-0.0392,0.0,0.0,0,0.1,0.15000000000000002,
151,mamma mio potere vedere,1,5,0.0,2,0,2,0.0096,0.0,0.0,0,0.0,0.0,
152,no inascoltabili,1,1,0.0,1,0,1,0.0,0.0,0.0625,1,0.0,0.0,
153,sperare giorno tutto sveglia protendiamo coraggio venire roma mio poco forza saro,1,21,0.0476,3,0,2,0.0187,0.0833,0.0123,1,-0.1875,0.5,
154,sei idiota vedere tuo profilo,1,9,0.0,2,1,0,-0.0131,0.0,0.0345,1,-0.8,0.8,
155,pena,1,2,0.0,1,0,0,0.0312,0.0,0.0,0,0.0,0.0,
156,renzi andare casa fare felice sacco gente,1,10,0.0,2,0,3,0.1383,0.0,0.0,0,0.8,1.0,
157,tutelare sicurezza vigilantes mezzo bastare,0,6,0.0,1,0,0,-0.0083,0.0,0.0,0,0.0,0.5,
158,finalmente matteo stendere quello,1,6,0.0,3,1,1,0.0,0.0,0.0,0,0.0,1.0,
159,manca briologia mettiti a,0,3,0.0,2,1,0,0.0,0.5,0.0,0,0.0,0.0,
160,,0,1,0.0,1,0,0,0,0,0,0,0,
161,fonte certo,0,5,0.0,2,1,0,0.1953,0.0,0.0,0,0.0,0.0,
162,marco essere anno vivo asino cerca cambiare,1,11,0.0,2,1,0,0.0289,0.0,0.0233,1,0.1,0.4,
163,ciao tutto minuto volere semplicemente aiutare tanto donna uomo come avere serio problema peso condizionare mio vita non riuscire svolgere tanto volta cosa molto semplice come fare costretta fido bel giorno poi avere letto questo commento come ora avere decidere mettere parte pregiudizio provare credere mai fare scelta migliore meno giorno fantastico prodotto naturale non stare parlare medicinale pagamento consegna lasciare qui sotto linker prodotto speranza ripetere aiutare qualcuno come bacio buono fortuna,0,103,0.1748,10,6,14,-0.0123,0.0274,0.0,0,0.10909090909090909,0.4816017316017316,
164,matteo ronda cittadina proposta lega tempo fa credo non avere poco volontario,1,18,0.0,3,1,1,0.0439,0.0,0.0,0,-0.1875,0.5,
165,colpa questo situazione assurdo chi governare dovere fermare ogni tipo sbandato immigrato rispedire subito suo paese italiano mettere prigione dove non puo piu nuocere nessuno invece realta italia tutto permesso coso chi lavorare onestamente rischiare continuo avere problema,1,56,0.0,3,1,6,-0.0042,0.0,0.0,0,0.06,0.44000000000000006,
166,mamma mio piu odioso strega bacheca,1,7,0.0,1,0,1,-0.1078,0.0,0.0286,1,0.5,0.5,
167,brutto montata arrogante saputello fronte italiano pagano obbligato fiore fiore stipendio unamused_face ,1,18,0.0,2,2,0,-0.027,0.0,0.0112,1,-0.35,0.5,
168,non ce fare proprio,0,5,0.0,2,1,0,-0.0469,0.0,0.0,0,0.2857142857142857,0.5357142857142857,
169,assolutamente no parlare essere alieno realta,1,8,0.0,2,1,0,0.1562,0.0,0.0,0,-0.175,0.825,
170,mito rocco,0,2,0.0,2,1,0,0.0,0.0,0.0,0,0.0,0.0,
171,sei faro matteo antislittamento,0,3,0.0,3,0,4,0.0,0.25,0.0,0,0.0,0.0,
172,voto,0,3,0.0,1,0,0,0.0078,0.0,0.0,0,0.0,0.0,
173,niente non puo piu,0,7,0.0,3,3,0,0.0,0.0,0.0,0,0.0,0.0,
174,guardo la,0,3,0.0,1,0,0,0.0,0.0,0.0,0,0.0,0.0,
175,diamine essere,0,4,0.0,2,1,0,0.0,0.0,0.0,0,0.0,0.0,
176,voto no seguire capitano renzi casa subito,0,11,0.0,1,0,0,-0.0785,0.0,0.0,0,0.2857142857142857,0.5357142857142857,
177,qualcuno appoggera questo pdf vedere qui non cambiare mai nulla,0,12,0.0,2,1,0,-0.0203,0.1,0.0,0,0.0,0.0,
178,vestita coso poi sembrare confetto,0,6,0.0,1,0,0,0.0208,0.0,0.0,0,0.0,0.0,
179,,0,1,0.0,1,0,0,0,0,0,0,0,
180,chiaro no,0,4,0.25,2,1,0,0.4434,0.0,0.0,0,0.10000000000000002,0.3833333333333333,
181,ovviamente no speranza grande premier mantenere parola,0,12,0.0833,2,1,0,-0.0215,0.0,0.0,0,0.4,0.625,
182,non vedere dove sia novita,0,7,0.0,3,0,2,-0.1161,0.0,0.0,0,0.13636363636363635,0.45454545454545453,
183,restare stomaco settimana,1,7,0.0,2,1,0,-0.0026,0.0,0.0,0,0.0,0.0,
184,giustizia privato,1,2,0.0,2,1,0,0.0352,0.0,0.0,0,0.0,0.375,
185,grande matteo falla nero,1,5,0.0,2,0,1,-0.0114,0.0,0.0417,1,0.3166666666666667,0.5916666666666667,
186,no bicarbonato,0,5,0.0,2,1,0,0.0,0.0,0.0,0,0.0,0.0,
187,essere parassita brolio,1,5,0.2,1,0,0,-0.0391,0.3333,0.0435,1,0.0,0.0,
188,mio ipotesi personale forse fantasioso tanto non cambiare cazzo non avere decidere elettore nemmeno avere decidere ed chi avere decidere non fare paura salvini popolo incazzare,1,47,0.0,2,0,1,0.033,-0.0385,0.0114,2,0.0,0.6,
189,castaldini terribile ignorante voce irritante parlare solo tavolo concertazione progetto condividere cosa significare praticamente niente face_screaming_in_fear  pouting_face ,1,26,0.0,6,3,4,-0.082,0.0,0.0146,2,-0.4375,0.8958333333333334,
190,votare no riforma fossa migliore non potere fare puro mandare casa,0,22,0.0,1,0,0,-0.1401,0.0909,0.0,0,-0.017857142857142863,0.5,
191,subito date TOP_arrow  flexed_biceps ,0,3,0.0,3,0,2,-0.106,0.5,0.0,0,0.0,0.0,
192,quello non digerire bicarbonato,1,8,0.0,1,0,0,0.0166,0.0,0.0,0,0.0,0.0,
193,bicarbonato porre gutta andare benissimo avere cambiare canale,1,16,0.0,1,0,2,0.0564,0.125,0.0,0,0.4166666666666667,0.5,
194,minchia coppia pingui pongo fare giocare,0,9,0.0,3,0,3,-0.0147,0.3333,0.0,0,-0.4,0.6,
195,istanti karman,0,2,0.0,1,0,0,0,1.0,0.0,0,0.0,0.0,
196,non vedere ridacchiare prendere vergogna,1,13,0.0,3,1,2,0.1319,0.0,0.0,0,0.0,0.0,
197,malpezzi castaldini,0,2,0.0,2,0,2,0.0,0.0,0.0,0,0.0,0.0,
198,vedro forza salvini essere,0,7,0.0,2,0,1,0.1324,-0.25,0.0,0,0.0,0.0,
199,aspettare muovere,0,2,0.0,3,0,3,0.0313,0.0,0.0,0,0.0,0.0,
200,dove vivo quello pianeta tutto suo,1,9,0.0,2,1,0,0.0049,0.0,0.0,0,0.36818181818181817,0.75,
201,dio esistere,0,2,0.0,2,1,0,0.0234,0.0,0.0,0,0.0,0.0,
202,malpezzi non porta mantenere sotto casa suo,1,15,0.0,2,1,0,0.0023,0.0,0.0,0,0.0,0.0,
203,salvini cerca fare votare lunedi comunale,0,11,0.0,1,0,0,0.0031,-0.1667,0.0,0,0.0,0.0,
204,problema difendere rischiare galera questo punto bisogna fare avere paura camminare strada solo loudly_crying_face ,0,28,0.0357,3,1,1,-0.102,0.0,0.0,0,-0.35,0.45,
205,come fare non definire strumentalizzare tutto puo capire sotto mano non eleggere paladino giustizia interessare ben poco giustizia interessare solo raccogliere voto cosa dire fatto parlare solo crimine legato immigrato solo solo solo immigrato vergone,1,54,0.0185,6,2,4,-0.0639,0.0286,0.0,0,0.10208333333333335,0.9,
206,matteo favetta ascoltare,0,3,0.0,1,0,0,0.0,0.3333,0.0,0,0.0,0.0,
207,non potere sentire,0,4,0.0,2,1,0,0.0,0.0,0.0,0,0.0,0.0,
208,malpezzi scandaloso vergogna,1,3,0.0,1,0,0,-0.3802,0.0,0.0,0,0.0,0.0,
209,avere gia dire poi diro stare scherzare,0,7,0.1429,4,1,6,0.0791,0.0,0.0,0,0.0,0.0,
210,questo guardare,0,3,0.0,1,0,0,0.0,0.0,0.0,0,0.0,0.0,
211,palla essere non sopportare stare zitto odioso,1,10,0.0,2,0,1,-0.0818,0.0,0.0217,1,0.0,0.0,
212,bene contraiamo coso,1,4,0.0,2,0,2,0.0787,0.3333,0.0,0,0.0,0.0,
213,mancare e maro dire credere simpatico face_with_tears_of_joy ,1,9,0.0,2,2,0,0.1012,0.0,0.0,0,0.5,1.0,
214,altro parvenze spesso vivo suo mondo pervenivano beato,0,13,0.0769,4,0,3,0.012,0.25,0.0,0,-0.012499999999999997,0.3875,
215,michele tuo collaborazione spinoza,0,7,0.0,2,1,0,0.0,0.0,0.0,0,0.0,0.0,
216,renzi iniziare tremare rimangiare tutto referendum votare no,1,13,0.0769,3,0,2,0.0059,0.0,0.0,0,0.0,0.0,
217,questo persona pretendere diritto dovere non accettare piu calpestare diritto altro,0,21,0.0,2,0,3,0.0111,0.0,0.0,0,0.1488095238095238,0.48214285714285715,
218,no sicuro,0,3,0.0,2,1,1,0.0309,0.0,0.0,0,-0.25,0.8888888888888888,
219,qua rompere marrone questo dieta vedere andare qui parlare cosa serie cavolo,1,22,0.0,2,1,0,0.0273,0.0,0.0395,3,0.0,0.0,
220,congratulazione,0,1,0.0,1,0,0,0.1562,0.0,0.0,0,0.0,0.0,
221,matteo bastare tutto questo baggianata dire questo demente falla zittire dare fiato,1,17,0.0,5,0,4,-0.0111,0.0,0.0241,2,0.0,0.5,
222,invece tentare proteggere restituire arma coso cosa risolvere solo,1,18,0.0,3,0,3,-0.0626,0.0,0.0,0,0.0,1.0,
223,pagare tutto pagare meno poi diminuire qualcosa ente locale aumentare doppio triplo come volere salvare comandata troppo male,1,22,0.0,6,3,5,-0.0063,0.0,0.0,0,-0.21666666666666662,0.18333333333333332,
224,salvino spaccare,0,3,0.0,1,0,0,0.0,0.5,0.0,0,0.0,0.0,
225,affermazione bulgaro piacere proprio forza frosinone,0,8,0.125,2,0,1,0.0256,0.1667,0.0,0,0.6,1.0,
226,vedere bene fare altro tipo lavoro avere bel fisico,1,14,0.0,3,1,2,0.1468,0.0,0.0,0,0.3625,0.6875,
227,pencolo italiota sempre,1,6,0.0,2,0,1,-0.0104,0.3333,0.0435,1,0.0,0.0,
228,fata attenzione balordo sinistro scrivere deludono occupano ecc,1,12,0.0,2,0,4,-0.0405,0.25,0.0159,1,-0.07777777777777779,0.14444444444444446,
229,veramente questo gia vomitare,1,4,0.25,1,0,0,0.1771,0.0,0.0345,1,0.2,0.2,
230,tono buffone dovere andare via,1,2,0.0,1,0,0,-0.0607,0.0,0.0333,1,0.0,0.0,
231,ciao salvini soltanto stanche avere fatto discorso sano difendere gli italiano esporre votero problema casa disoccupazione misero pensione attribuire tutto invasione clandestino fortuna cittadino andare svegliare parlare senza paura contro politico era ora matteo coso mandare tutto fanciullo,1,52,0.0,1,0,0,-0.0476,0.0526,0.0034,1,-0.18,0.64,
232,bronzo sicuro sicuro sicuro ghenghe,0,5,0.0,3,2,0,0.0375,0.2,0.0,0,0.5,0.5,
233,ridicola ed inutile,1,3,0.0,1,0,0,-0.1875,0.0,0.0,0,-0.41666666666666663,0.6,
234,salvini stia calmo sopportare imbecillita questo sinistra,1,11,0.0,4,0,3,-0.1039,-0.1429,0.0175,1,0.15000000000000002,0.375,
235,scusare quale referendum andra votare cosa disterai,0,12,0.0,3,2,0,0.0125,0.1429,0.0,0,-0.05,0.05,
236,distruggere,1,1,0.0,1,0,0,-0.125,0.0,0.0,0,-0.2,0.0,
237,giriamo oltre ad essere stare nci fa tanto simpatica poi sposata pota pdf pazzesco,1,24,0.0,5,0,4,0.0804,0.2857,0.0,0,0.08333333333333333,0.7166666666666667,
238,ritorno dittatura renzi buffone volere questo,1,8,0.0,3,1,2,0.0835,0.0,0.0222,1,0.0,0.0,
239,leccai,1,1,0.0,1,0,0,0,1.0,0.0,0,0,0,
240,no parlare troppo fino ora avere dimostrare fatto niente credere dovere dimostrero subito urgere sempre scusa parlamento avere poi giorno mese anno passare votare gente votare pensare molto primo chi votare,1,44,0.0,5,0,5,-0.0325,0.0645,0.0,0,0.15833333333333335,0.22777777777777777,
241,essere fuso tutto non drogare,1,10,0.0,2,1,0,0.0215,0.0,0.0,0,0.0,0.0,
242,capitano sbrigare essere qui divano ad aspettare grinning_face_with_smiling_eyes ,0,9,0.0,3,4,0,0.0195,0.0,0.0,0,0.0,0.0,
243,buono fare colf paga sindacale,1,7,0.0,3,0,3,0.1681,0.0,0.0333,1,0.7,0.6000000000000001,
244,ruspa avanti tutto tractor ,0,3,0.0,3,2,0,0.0,0.0,0.0,0,0.0,0.0,
245,resistere insulto difendere,0,4,0.0,3,2,0,-0.0749,0.0,0.0,0,0.0,0.0,
246,non prendere tuo archetto politico finanziare guerra piu tosto perseguitare chi scappare sei classico politico italiano presto sparire,1,28,0.0,4,0,5,-0.0326,0.0556,0.0,0,0.016666666666666663,0.06666666666666667,
247,uomo inutile vivo soldo popliti anno bastare mantenuto leghista,1,18,0.0556,2,0,2,-0.0009,0.1111,0.0159,1,-0.13333333333333333,0.3666666666666667,
248,avanti coso presidente,0,3,0.0,2,1,0,0.0039,0.0,0.0,0,0.0,0.0,
249,avere ragione completamente,0,3,0.6667,2,0,1,0.2901,0.0,0.0,0,0.19285714285714284,0.46785714285714286,
250,malpezzi dire sempre avere fatto cosa avere fatto volere vedere pensione euro vedere cosa fare quello occhio croce essere abituato bene,1,32,0.0,5,1,3,0.0082,0.0,0.0,0,0.0,0.0,
