734,essere guitto significato piu antico vostro ospite recitare parte cuscini cattivo parvenze piu meno buono saggio ospite ormai noioso gufaggine dovere peggiorare morire,1,36,0.0,4,0,8,-0.0741,0.1304,0.006,1,0.14761904761904762,0.6047619047619046,
735,sequenza bugia presa culo,1,9,0.4444,1,0,0,0.0117,0.0,0.04,1,0.0,0.0,
736,matteo mettere tutto ko,0,5,0.0,1,0,0,0.0001,0.0,0.0,0,0.0,0.0,
737,essere stare brancata dopo avere sputtanare post bambino pornodiva prego andare serpentello,1,20,0.0,3,1,2,-0.0371,0.1667,0.022,2,-1.0,1.0,
738,no guardo appostare convincere sempre piu avere ragione,0,12,0.0,3,0,2,0.1205,0.0,0.0,0,0.42857142857142855,0.5119047619047619,
739,foto tradimento grande matteo,0,7,0.0,3,2,0,0.0133,0.0,0.0,0,0.0,0.1,
740,essere idiota stare proprio stomaco,1,8,0.0,1,0,1,-0.0039,0.0,0.0286,1,-0.8,0.8,
741,certo essere matteo,0,5,0.0,2,0,1,0.1095,0.0,0.0,0,0.5,0.8888888888888888,
742,no compimento,0,2,0.0,1,0,0,0,0.5,0.0,0,0.0,0.0,
743,mio voto no,0,5,0.2,1,0,0,0.0625,0.0,0.0,0,0.0,0.0,
744,non sopportare piu gallina spelacchiare,1,7,0.0,2,0,1,-0.001,0.0,0.0,0,0.0,0.0,
745,capitano forza tutto,0,3,0.0,1,0,0,0.0583,0.0,0.0,0,0.0,0.0,
746,voto no avere decidere essere come volere non come volere,0,16,0.0625,1,0,1,-0.0143,0.0,0.0,0,0.0,0.0,
747,ringraziare prosapia pdf,0,5,0.0,1,0,0,0.0,0.6667,0.0,0,0.0,0.0,
748,niente,0,2,0.5,2,1,1,0.0,0.0,0.0,0,0.0,0.0,
749,buttare campo roma poi ruspa thumbs_up ,1,7,0.0,1,0,0,-0.003,0.2,0.0357,1,0.0,0.0,
750,essere piu intelligente governo renzi,0,7,0.0,2,3,0,0.0,0.0,0.0,0,0.0,0.0,
751,numi,0,1,0.0,1,0,0,0,1.0,0.0,0,0.0,0.0,
752,fossa stare cane gatto essere intervenire,0,10,0.0,1,0,0,-0.0406,0.0,0.0244,1,0.0,0.0,
753,matteo aspettare,0,6,0.0,1,0,1,-0.0938,0.0,0.0,0,0.0,0.0,
754,stare guardare formile adesso cambio,0,7,0.0,2,1,0,0.0423,0.2,0.0,0,0.0,0.0,
755,tutto dovere votare no,0,4,0.0,2,1,0,0.0039,0.0,0.0,0,0.0,0.0,
756,presidente non dimenticare sito archeologico ostia antico meraviglia ed perla raro abbraccio,0,18,0.0,3,0,4,0.0805,0.0,0.0,0,0.15,0.45,
757,puo mettere dentro corniola cosa reale cosa verita essere definizione come tale non esistere non esistere realta verita esistere percezione fatto conseguenza definizione,0,39,0.0,6,2,3,0.009,0.0435,0.0,0,0.1,0.4,
758,avere male stomaco,1,4,0.0,2,1,2,-0.251,0.0,0.0,0,-0.6999999999999998,0.6666666666666666,
759,votare tutto no,0,3,0.3333,1,0,0,0.0078,0.0,0.0,0,0.0,0.0,
760,quello figlio vanta marco pigliare ano piu profondo,1,11,0.0,2,0,2,0.0063,0.125,0.0,0,0.0,0.0,
761, flushed_face ,0,1,0.0,1,0,0,0,0,0,0,0,
762,matteo sei esempio tutto italiano essere orgoglioso premier finalmente stimare universaliste,0,15,0.0,2,0,2,0.0737,0.0909,0.0,0,0.4,1.0,
763,sapere solo questo non volere fossa mondo parvenze,0,12,0.0,2,0,1,-0.0175,0.125,0.0,0,0.0,1.0,
764,matteo non dire niente,0,4,0.0,2,1,0,-0.0007,0.0,0.0,0,0.0,0.0,
765,sicuramente,0,1,0.0,1,0,0,0.125,0.0,0.0,0,0.21428571428571427,0.5714285714285714,
766,domanda certo,0,6,0.0,3,2,0,0.1799,0.0,0.0,0,0.5,0.8888888888888888,
767,non sopportare fare sapientone essere solo teste,1,13,0.0,2,0,2,0.0039,0.0,0.0,0,0.7,0.9,
768,fossa segno divino credo essere arrivare primo essere moltiplicare tosti altro,0,17,0.0,2,0,1,0.0317,0.0909,0.0,0,0.041666666666666664,0.23611111111111108,
769,non fare mai politico italiano fottere popolo,1,13,0.0,2,1,0,-0.0688,0.0,0.0222,1,-0.2,0.3,
770,odioso,1,1,0.0,1,0,0,-0.125,0.0,0.0,0,0.0,0.0,
771,aspettare non fare attendere potere essere troppo tardi,0,9,0.0,3,0,3,0.0228,0.0,0.0,0,-0.3,0.6,
772,daniele face_with_tears_of_joy ,0,2,0.0,1,0,0,0,0.0,0.0,0,0,0,
773,quanto passo vicino al ortica puro non toccare avere urticanti essere preporre fare incazzare,1,18,0.0,3,0,2,-0.0197,0.1429,0.0108,1,0.17142857142857146,0.3666666666666667,
774,arrivare malpezzi avere bisogno fa tacere,1,12,0.0,1,0,0,-0.0078,0.0,0.0,0,0.0,0.0,
775,underground normalita tutto sapere non tutto dire,0,10,0.0,3,1,1,0.0041,0.1429,0.0,0,0.0,0.0,
776,votero no sperare andare casa veramente,0,10,0.0,1,0,0,-0.124,0.0,0.0,0,0.2,0.2,
777,venire vomitare,1,4,0.0,1,0,0,-0.0312,0.0,0.0667,1,0.0,0.0,
778,,0,2,0.0,2,0,1,0,0,0,0,0,
779,introvabili coraggio,1,5,0.0,2,1,0,-0.1875,0.5,0.0,0,0.0,0.0,
780,ossiuro caro matteo odio,1,8,0.0,2,1,2,0.0391,0.25,0.0,0,-0.8,0.9,
781,male testa solo vedere,1,6,0.0,1,0,0,-0.1531,0.0,0.0,0,-0.6999999999999998,0.6666666666666666,
782,insopportabile,1,1,0.0,1,0,0,-0.3125,0.0,0.0,0,0.0,0.0,
783,dire cosa fare legge legge annullare vicenda risiere costituzione legge nuovo partire numero nuovo legge,0,24,0.0,2,1,4,0.0227,0.0667,0.0,0,0.03693181818181818,0.34602272727272726,
784,renzi dovere proprio stare zitto non avere votare nessuno,1,11,0.0,2,1,0,-0.0125,0.0,0.0,0,0.0,0.0,
785,essere odioso indigesto fare male orecchio sentire,1,9,0.0,3,1,1,-0.1162,0.0,0.02,1,0.0,0.0,
786,finire al dispiacere andare matteo,0,6,0.0,4,1,3,-0.1904,0.0,0.0,0,-0.55,0.95,
787,incredibile come invece dimostrare sensibilita verso dramma quello ragazza avere pensare solo chi starnazzare piu forte,1,21,0.0476,2,1,0,0.0473,0.0,0.0,0,0.45,0.95,
788,avere ragione presenzio,0,3,0.0,1,0,0,0.1339,0.3333,0.0,0,0.2857142857142857,0.5357142857142857,
789,voto,0,3,0.0,2,0,1,0.0078,0.0,0.0,0,0.0,0.0,
790,dire no volere aceto mela amaro capo,0,12,0.0,1,0,0,0.0394,0.0,0.0,0,-0.1,0.5,
791,quello racchio,1,3,0.0,1,0,0,-0.0547,0.0,0.0714,1,0.0,0.0,
792,questo vomitare,1,2,0.0,1,0,0,0.0,0.0,0.0667,1,0.0,0.0,
793,silurante no,0,3,0.3333,2,1,0,0.125,0.5,0.0,0,0.0,0.0,
794,non riuscire digerire pasta figurare questo ftalo,1,12,0.0,1,0,0,-0.1051,0.0,0.0,0,0.5,0.625,
795,meglio vedere prenome dario argento meno brivido,0,8,0.0,1,0,0,0.0876,0.1429,0.0,0,0.16666666666666669,0.2833333333333333,
796,effetto rum,0,1,0.0,1,0,0,-0.0723,0.0,0.0,0,0.0,0.0,
797,voto bifolchi ignorante,1,5,0.2,1,0,0,-0.0781,0.0,0.0435,1,0.0,0.0,
798,venire vomito,1,4,0.0,2,0,1,-0.0156,0.0,0.0769,1,0.0,0.0,
799,parvenze vivo mundio tutto suo,0,10,0.0,2,0,1,0.0034,0.4,0.0,0,0.6,1.0,
800,voto no presidente consiglio abusivo,0,7,0.0,2,0,1,0.1797,0.0,0.0278,1,0.0,0.0,
801,,0,2,0.0,1,0,0,0,0,0,0,0,
802,nemmeno librandi carature,0,4,0.0,1,0,0,0.0078,0.3333,0.0,0,0.0,0.0,
803,cucco,0,2,0.5,2,1,0,0.0,0.0,0.0,0,0.0,0.0,
804,casa diritto persona famiglia non potere permettere stare dovere provvedere entro mese dare sequestrato comune votacci tuo seguace dormire cartone sotto ponte,1,42,0.0,4,2,2,-0.0137,0.0455,0.0,0,0.13333333333333333,0.5083333333333333,
805,no essere tutto odioso maleducato raccontare sacco balla coma renzi,1,15,0.0,1,0,0,0.0719,0.0,0.0448,3,-0.2,0.3,
806,titolo esatto era tornare lunedi morto fame,0,14,0.0,2,0,2,-0.0995,0.0,0.0,0,0.016666666666666663,0.21666666666666667,
807,matteo asfaltare,1,1,0.0,3,1,2,0,0.0,0.0,0,0,0,
808,ignorante voto no no no no no mai poi mai no nemmeno marco uccidere io voto no meno,0,24,0.0,1,0,0,0.0425,0.0,0.0,0,0.08333333333333333,0.06666666666666667,
809,renzi faccia bronzo faccia latta doppia faccia faccia giano solo rocchio sapere quote faccia avere,1,19,0.0,2,0,4,-0.0116,0.1333,0.0,0,0.0,0.5,
810,non fata referendum italiano volere roma invece precedente avere tutto paura essere voto no ladro piccolo grande niente galera fata schifo politico non sapere risolvere questo problema,1,36,0.0,13,1,13,-0.0391,0.037,0.0163,3,-0.19236111111111112,0.27777777777777773,
811,questo guardare quinta colonna non riuscire capire come puo andare tivu raccontare proprio stupro come puo essere coso tranquillo voglia avere sottoporre domanda coso ricordare quello momento atroce non ce fare guardare sentire parlare non sembrare poi coso sofferente boy forse capitare tivu essere ultimo mio pensiero non pensare nemmeno forse fa soldo boy,1,82,0.0,9,0,9,-0.0319,0.0741,0.0028,1,-0.04999999999999999,0.50625,
812,no,0,2,0.5,2,1,0,0,0.0,0.0,0,0,0,
813,voto no,0,4,0.0,2,0,1,0.0078,0.0,0.0,0,0.0,0.0,
814,bel film cui essere tanto,0,9,0.0,1,0,0,0.3041,0.0,0.0,0,0.7,0.6000000000000001,
815,ochette ben pagare,1,5,0.0,1,0,0,0.3047,0.0,0.0,0,0.0,0.0,
816,brulico,0,1,0.0,2,1,0,0,1.0,0.0,0,0,0,
817,non digerire nemmeno assaggio,1,6,0.0,2,1,0,0.0254,0.0,0.0,0,0.0,0.0,
818,no mondo reale parvenze vivo solo secondo,1,9,0.0,3,0,2,0.0,0.1429,0.0,0,0.0,0.42500000000000004,
819,do disgrazie,1,2,0.0,1,0,0,-0.4219,0.5,0.0,0,0.0,0.0,
820,non volere essere tuo porre volere pazienza vendere bravo,0,12,0.0,5,2,2,0.1496,0.0,0.0,0,0.475,0.675,
821,no assolutamente,0,2,0.0,2,1,0,0.375,0.0,0.0,0,-0.1,0.9,
822,fallimento questo paese,1,4,0.0,2,0,1,-0.0781,0.0,0.0,0,0.0,0.0,
823,questo aspettare essere stanca morta,0,8,0.0,1,0,0,-0.1501,0.0,0.0,0,-0.30000000000000004,0.55,
824,pesante come debito,1,3,0.3333,3,0,3,-0.0078,0.0,0.0,0,-0.2,0.5,
825,finira sara sempre tardi intanto dovere sventi blaterare,1,13,0.0,2,0,2,-0.0199,0.125,0.0,0,-0.3,0.6,
826,dire come soia network mondo catartico dove non esistere filtro morale rental linfe,0,18,0.0,2,0,2,-0.0156,0.2308,0.0,0,0.0,0.25,
827,no,0,1,0.0,2,1,0,0,0.0,0.0,0,0,0,
828,non esistere piu diritto italiano volere stare faccia rispettare diritto proprio cittadino regolare,1,18,0.0,3,1,2,0.0251,0.0,0.0,0,0.06428571428571428,0.3296703296703296,
829,salvini routine dire minchiate,1,6,0.0,1,0,0,0.0931,-0.25,0.0333,1,0.0,0.0,
830,parlare aria friggere,1,5,0.0,3,1,1,0.0,0.0,0.0,0,0.0,0.0,
831,malpezzi fine mese roma centro fa nuda vasca prendere euro deputata pdf festeggiare,1,23,0.0,3,1,1,0.0392,0.1538,0.012,1,0.12222222222222222,0.2333333333333333,
832,intanto bela bela bela,0,4,0.0,2,0,1,0.0,0.75,0.0,0,0.0,0.0,
833,quando vedere avere bisogno digestivo aho aho,1,10,0.0,2,0,2,-0.0071,0.2857,0.0,0,0.0,0.0,
834,malpezzi para criceto correre imperterrito suo ruota mondo tutto suo gente lamentare essere poco donna politica non sapere pensare malpezzi fare casino non sentire rappresentare non solo come politica come donna modo cui pensare parola dire essere alquanto raccapricciante,1,67,0.3881,4,1,3,0.0117,0.0,0.0037,1,0.0,0.55,
835,forza capitano fatto valere,0,4,0.0,1,0,0,0.0846,0.0,0.0,0,0.35,0.65,
836,persona odioso solo sentire parlare,1,8,0.0,2,0,2,-0.0974,0.0,0.0286,1,0.0,1.0,
837,certo ciao gitana,0,3,0.0,1,0,0,-0.0103,0.3333,0.0,0,0.5,0.8888888888888888,
838,insopportabile tutto vandea retro,1,5,0.0,3,1,2,-0.0781,0.25,0.0,0,0.0,0.0,
839,quello super figa,0,4,0.25,2,1,0,-0.0625,0.0,0.0588,1,0.3333333333333333,0.6666666666666666,
840,stefano lorenzo,0,2,0.0,1,0,0,0,0.0,0.0,0,0,0,
841,certo volentieri fare stuart zitto quello pdf non puo sentire,1,15,0.0667,3,0,2,0.05,0.2,0.0,0,0.0,0.3333333333333333,
842,malpezzi mostro simpatia non sbaglio tutto arrogante svanenti parolaio presto tardi rendere conto sceneggiata,1,22,0.0,2,0,2,-0.0145,0.0714,0.0,0,0.1,0.3,
843,ottobre vincere avere nuovo posto immunita parlamentare sindaco come quello lodo beccare formattare poco comune cancellare prova colpevolezza,1,29,0.0,5,0,7,0.0199,0.0556,0.0,0,-0.010227272727272719,0.5709090909090909,
844,questo guardare piazza pulito vergognoso germania respingere immigrato senza alcun controllo fare partire treno fare arrivare italia,1,25,0.0,4,2,1,-0.0242,0.0,0.0,0,0.3666666666666667,0.7000000000000001,
845,bloccare digestione ogni volta vedere,1,10,0.0,2,0,1,0.0349,0.0,0.0,0,0.0,0.0,
846,cosa fara governo rilanciare investimento privato creazione nuovo posto lavoro presidente renzi,0,19,0.0,2,1,0,0.0175,0.0,0.0,0,0.06818181818181818,0.4147727272727273,
847,digestione buono fegato chi casa risentire non potere rispondere dovere,1,22,0.0,1,0,1,0.0413,0.0,0.0,0,0.7,0.6000000000000001,
848,abolire questo studio settore licenziare chi sbagliare pubblico amministrazione pensione anno,0,15,0.0,2,1,1,-0.0087,0.0,0.0,0,0.0,0.06666666666666667,
849,essere indigesto,1,2,0.0,2,0,1,-0.3125,0.0,0.0,0,0.0,0.0,
850,dire avere trovare questo esempio,0,9,0.0,3,0,3,0.028,0.0,0.0,0,0.0,0.0,
851,no no no,0,1,0.0,3,0,3,0,0.0,0.0,0,0,0,
852,essere po riconoscente tutto questo dono,0,10,0.0,2,0,1,0.0309,0.0,0.0,0,-0.1875,0.5,
853,voto no questo stomaco renzi bosco tutto pdf completo comprendere guernivno,1,21,0.0,1,0,0,0.0412,0.25,0.0,0,0.1,0.4,
854,recitare parte quello fare,0,7,0.0,1,0,0,0.0,0.0,0.0,0,0.0,0.0,
855,no,0,2,0.0,2,0,1,0,0.0,0.0,0,0,0,
856,odioso,1,1,0.0,1,0,0,-0.125,0.0,0.0,0,0.0,0.0,
857,certo essere incoraggiare autorita,0,6,0.0,1,0,0,0.1622,0.0,0.0,0,0.5,0.8888888888888888,
858,digerire poi leggere andare aro cesso,0,9,0.0,1,0,1,-0.0066,0.1667,0.0,0,-0.03333333333333333,0.0,
859,nicola mazzini,0,2,0.0,1,0,0,0,1.0,0.0,0,0,0,
860,no renzi tutto suo pecora,1,9,0.1111,1,0,0,-0.0547,0.0,0.04,1,0.0,0.0,
861,no castaldini fortemente indigesto,1,7,0.0,1,0,0,0.0729,0.0,0.0,0,0.4333333333333333,0.7333333333333333,
862,condividere quello cannabismo quello meditavo verita oggettivo,0,12,0.0,3,1,1,0.1172,0.2857,0.0,0,0.0,0.1,
863,essere pena votero sperare avere questo su potere passare po minuto campo zingaro essere vitate poi volere vedere dire,1,32,0.0,3,0,3,0.0154,0.1053,0.0085,1,0.2708333333333333,0.5416666666666666,
864,mio marito non avere piu lavoro adeguare fare qualsiasi lavoro puro portare mangiare casa invece immigrato dare soldo ricarica cibo essere soddisfare schifo,1,36,0.0,5,1,6,-0.0292,0.0435,0.0064,1,0.21428571428571427,0.5,
865,campo roma andare chiuso altrimenti fare fare stare campo dove non venire dentro attrezzare difendere come fare,1,27,0.037,1,0,0,0.0005,0.0588,0.009,1,-0.1,0.1,
866,salvini salvare pensione primis,0,4,0.0,4,2,2,0.0614,-0.25,0.0,0,0.0,0.0,
867,caro marco essere fare avere tuo indirizzo venire persona dare sberle bifolco ignorante non puo dire nessuno meno piedino sapere solo offendere aspetto tuo notizia,1,37,0.0,5,3,9,0.0329,0.04,0.0061,1,-0.16666666666666666,0.06666666666666667,
868,parvenze galleggia cuscini nuota,0,3,0.0,1,0,0,0.0,0.5,0.0,0,0.0,0.0,
869,ormai essere monotona,0,3,0.0,2,1,0,-0.125,0.0,0.0,0,0.0,0.0,
870,mamma mio insopportabile,1,3,0.0,1,0,0,-0.1562,0.0,0.0417,1,0.0,0.0,
871,oggi para impossibile fare commento reale senza essere chiamare razzista,0,13,0.0,2,0,2,-0.01,0.0,0.0,0,-0.2333333333333333,0.65,
872,peggio altro questo pure preoccupare roma non andare scuola andare sgombrare campo,1,24,0.0417,4,0,3,-0.0367,0.1667,0.0122,1,-0.2625,0.4875,
873,ankara,1,2,0.0,1,0,0,0,1.0,0.0,0,0.0,0.0,
874,gallina frustrato,1,2,0.0,1,0,0,-0.0859,0.0,0.0,0,-0.7,0.2,
875,assolutamente no,0,2,0.0,1,0,0,0.375,0.0,0.0,0,-0.1,0.9,
876,non propio,0,2,0.0,1,0,0,0.0,0.0,0.0,0,0.0,0.0,
877,parvenze non esistere,0,6,0.1667,2,1,0,-0.0156,0.3333,0.0,0,0.0,0.0,
878,no no no tutto no,0,5,0.0,5,4,0,0,0.0,0.0,0,0.0,0.0,
879,questo solo vedere venire tachicardia nervoso sentire parlare dovere prendere calmante debbio invitare fare innervosire,1,27,0.0,4,4,3,0.0013,0.0667,0.0084,1,0.0,0.0,
880,no bastare,0,3,0.3333,2,1,2,-0.0625,0.0,0.0,0,0.0,0.5,
881,parvenze molto piu reale zanzara non inutile deprimente dibattito proclitici la,0,17,0.0,1,0,0,0.0499,0.1818,0.0127,1,0.0875,0.475,
882,cartellonisti furbo,0,3,0.3333,1,0,0,0.125,0.5,0.0,0,0.16666666666666666,0.8333333333333334,
883,essere pure brutto vedere,1,5,0.0,2,1,0,-0.2286,0.0,0.04,1,-0.7,1.0,
884,matteo aspetto ad altoatesino lucca giovedi non mollare,0,9,0.0,2,1,2,0.0205,0.125,0.0,0,0.0,0.0,
885,aspetto ruspa,1,2,0.0,3,1,2,0.001,0.0,0.0,0,0.0,0.0,
886,rincoglionire totalmente librandi carature danno mano vergognarsi bastardo,1,11,0.0,1,0,0,-0.0636,0.125,0.0135,1,0.0,0.75,
887,purtroppo,0,1,0.0,2,1,2,-0.4375,0.0,0.0,0,-0.5,1.0,
888,dispiacere paragonare al rispetto vedere questo mentre altro parlare ridonare sotto baffo interrompere debbio dovere spedire fuori studio subito,1,29,0.0,3,0,6,-0.0248,0.0526,0.0,0,-0.125,0.375,
889,andare ricordero tutto quello dire volere mantenere,0,15,0.0,1,0,0,0.0394,0.0,0.0,0,0.0,0.0,
890,malpezzi castaldini fare vergone essere donna cinico bugiardo pouting_face ,1,15,0.0,1,0,0,-0.1667,0.125,0.0164,1,-0.6,1.0,
891,pure,0,2,0.0,1,0,0,0,0.0,0.0,0,0,0,
892,carita mollare,0,5,0.0,4,2,1,0.0712,0.0,0.0,0,0.0,0.0,
893,non riuscire digerire,1,4,0.0,1,0,0,-0.0459,0.0,0.0,0,0.5,0.625,
894,no quando essere cambio canale vivere altro pianeta,1,14,0.0,1,0,0,0.0019,0.0,0.0,0,0.0,0.0,
895,no soprattutto primo,0,4,0.0,2,0,2,-0.0098,0.0,0.0,0,-0.0625,0.16666666666666666,
896,salvini seguire lega dovere capire dovere correre solo lungo paghera invece mettere sempre quello altro bulgari destra capitale imbroglio,1,30,0.0,3,0,5,0.0229,0.0,0.0,0,0.027678571428571427,0.5776785714285714,
897,malpezzi castaldini essere adatto pulizia gabinetto stazione,1,14,0.0,1,0,0,0.0249,0.0,0.0,0,0.55,0.75,
898,ridicola,1,1,0.0,2,0,1,-0.4062,0.0,0.0,0,-0.5,0.875,
899,pericoloso questo brutto razzista bianco destra sinistra avere finire scusa avanti matteo,1,16,0.0,4,2,1,-0.1241,0.0,0.0112,1,-0.1773809523809524,0.4142857142857142,
900,mano essere,0,4,0.0,1,0,0,0.0156,0.0,0.0,0,0.0,0.0,
901,poveretta,1,2,0.0,2,1,0,-0.2285,0.0,0.0,0,-0.4,0.6,
902,adesso saltare fuori non avere mai dire jobber acta dovere creare posto lavoro,0,17,0.0,1,0,0,-0.007,0.1538,0.0,0,0.0,0.0,
903,essere capra arrogante cercare prendere giro italiano bisogna informare non riuscire essere veramente ridicola fare pena,1,24,0.0,1,0,0,-0.0385,0.0,0.0083,1,-0.17777777777777778,0.39999999999999997,
904,tutto giorno vedere tivu politico cazzo canone non puo sfilare attore claxon,1,19,0.0526,2,1,0,0.0059,0.25,0.0132,1,0.125,0.23333333333333334,
905,questo morire sei numero matteo,0,8,0.0,1,0,1,-0.1663,0.0,0.0,0,0.0,0.0,
906,presidente processo ricollocamento dipendente provinciale curi avere vanificare quasi biennio graduatoria concorso pubblico non ritenere sia corretto restituire tale tempo validita graduatoria non ritenere sia corretto restituire tempo idoneo pia,0,44,0.0455,4,2,2,-0.0435,0.0667,0.0,0,0.18333333333333335,0.4388888888888889,
907,voto no,0,3,0.0,1,0,0,0.0078,0.0,0.0,0,0.0,0.0,
908,,0,1,0.0,1,0,0,0,0,0,0,0,
909,avere sentire parlare primo volta canone grazia al pornostar partecipare sembrare quasi incredibile questo notizia,0,21,0.0,2,0,1,0.0218,0.0667,0.0,0,0.0,0.6666666666666666,
910,questo provare solito delirio smiling_face_with_smiling_eyes  see-no-evil_monkey  hear-no-evil_monkey  speak-no-evil_monkey ,0,5,0.0,2,0,2,-0.0833,0.0,0.0,0,-0.25,0.25,
911,,0,2,0.0,2,0,1,0,0,0,0,0,
912,ovviamente,0,2,0.5,1,0,0,0.25,0.0,0.0,0,0.0,0.5,
913,no sopportare pensare matteo zittire venire voglia tirare telecomando tivu,1,17,0.0,2,0,1,0.0387,0.1,0.0,0,-0.1,0.2,
914,no vedere malpezzi brava parlare piacere suo orecchino face_with_tears_of_joy ,0,17,0.0,1,0,0,-0.085,0.0,0.0,0,0.7,0.6000000000000001,
915,certo essere bisogna radere suolo questo governo incompetente continuare rubare questo massacrare,1,19,0.0,2,1,2,-0.0755,0.0,0.0103,1,-0.06785714285714285,0.46904761904761905,
916,,0,1,0.0,1,0,0,0,0,0,0,0,
917,chi avere votato questo dovere pure pagare,0,11,0.0,1,0,0,0.0241,0.0,0.0,0,0.0,0.0,
918,voto no faccia renzi,0,7,0.5714,2,0,1,0.0209,0.0,0.0,0,0.0,0.0,
919,questo guardare trasmissione,0,4,0.0,1,0,0,0.0,0.0,0.0,0,0.0,0.0,
920,cazzata,1,2,0.0,2,1,0,-0.0938,0.0,0.0,0,-0.8,0.8,
921,certo,0,1,0.0,1,0,0,0.0,0.0,0.0,0,0.0,0.0,
922,matteo gia sale ruspa passo sopra questo cretino malpezzi castaldini liberare questo pallose bugiardo schifoso vivere altro pianeta scendere italia solo ritirare stipendio questo sutri utilizza,1,33,0.0,9,0,15,-0.0447,0.0769,0.0207,4,-0.01477272727272727,0.5458333333333333,
923,grande matteo saluto alghero,0,6,0.0,2,0,1,0.127,0.0,0.0,0,0.8,0.75,
924,votero no volere salvini come presidente capire italiano prendera cura essere sicuro non tradira mai fara suo lavoro come promesso abbraccio salvini siciliano tutto essere,0,47,0.0,4,2,1,-0.015,-0.08,0.0,0,0.25,0.4444444444444444,
925,votero no riforma pasticciare fatta male problema essere altro essere lavoro tassa immigrazione fuori controllo questo essere cosa piu importante non unione civile riforma elettorale,0,34,0.0294,3,2,2,0.0285,0.0,0.0,0,0.006250000000000061,0.5854166666666667,
926,volere prendere schiaffo quello fa strano oggi pdf ancora primo porre boy,1,20,0.05,4,0,3,0.0005,0.1667,0.0,0,0.1,0.24166666666666664,
927,indiscutibili thumbs_down ,0,1,0.0,1,0,0,0,1.0,0.0,0,0.0,0.0,
928,strazio,1,3,0.0,2,1,0,0.0977,0.0,0.0,0,0.0,0.0,
929,non sopportare questo sera fare zappino piazza pulito quinta colonna,1,9,0.0,4,0,5,0.0493,0.1,0.0,0,0.3666666666666667,0.7000000000000001,
930,inmii famigliare sicuramente no sperare perdere andare veramente casa grazia essere,0,15,0.0,2,1,2,0.0466,0.0909,0.0,0,0.10833333333333334,0.5296296296296296,
931,votero no ovvio,0,3,0.0,1,0,0,-0.125,0.0,0.0,0,0.0,0.5,
932,ciao matteo salvare questo quando casa sei arrivare questo momento fatto sentire,0,15,0.0,4,2,1,0.0251,0.0833,0.0,0,0.0,0.0,
933,questo contraddire renzi avra esagerato vino ieri sera,1,12,0.0,2,1,0,0.0279,0.0,0.0,0,-0.25,0.5333333333333333,
934,matteo numero onte,0,4,0.0,2,1,0,0,0.6667,0.0,0,0.0,0.0,
935,parvenze normale stereotipo parlato,1,9,0.1111,2,1,2,-0.0508,0.5,0.0,0,0.15,0.6499999999999999,
936,impossibile,0,1,0.0,1,0,0,-0.2969,0.0,0.0,0,-0.6666666666666666,1.0,
937,andare matteo,0,3,0.0,3,2,0,-0.1113,0.0,0.0,0,-0.6,0.9,
938,proprio veneto sapere essere maestro bestemmia,0,12,0.0,4,1,4,0.0045,0.0,0.0,0,0.0,0.0,
939,mangiare cagare tutto upside-down_face ,1,12,0.0,1,0,0,0.0078,0.0,0.0476,1,0.0,0.0,
940,voto no,0,3,0.0,1,0,0,0.0078,0.0,0.0,0,0.0,0.0,
941,cucchiaino bicarbonato deglutire bicchiere vino rosso riuscire provare fa digerire pietra duro,1,21,0.0476,3,0,2,-0.0292,0.0,0.0,0,-0.14583333333333334,0.2708333333333333,
942,notino,0,1,0.0,2,0,1,0,1.0,0.0,0,0,0,
943,uomo anno moglie figlio problema grave lavoro precario,0,14,0.0,1,0,0,-0.0956,0.0,0.0,0,-0.3333333333333333,0.6666666666666666,
944,copiare francia complimento ricchezza lessicale poi avere scrivere libro,0,14,0.0714,4,0,3,0.0279,0.0,0.0,0,0.0,0.0,
945,carita,0,2,0.0,2,1,0,-0.3448,0.0,0.0,0,-0.1875,0.5,
946,volta stomaco cambio subito canale,1,7,0.0,1,0,0,-0.0319,0.0,0.0,0,0.0,0.0,
947,piccione fava bel colpo fulmine,0,10,0.0,3,0,2,0.0832,0.0,0.0323,1,0.45625,0.65625,
948,cuscini guardare post,0,4,0.0,2,1,0,0.0208,0.3333,0.0,0,0.0,0.0,
949,presente,0,2,0.0,2,1,0,0,0.0,0.0,0,0.0,0.0,
950,avere ragione stanche questo peggiorare tutto balla castaldini balla malpezzi essere paese favola essere tutto felice non avere lavoro pensione vivere aria palla governo rompono pancia,1,45,0.0,1,0,1,-0.0005,0.0769,0.0163,3,0.20551948051948052,0.6839285714285714,
951,sei cospira,0,4,0.0,1,0,0,0.0,0.5,0.0,0,0.0,0.0,
952,non dorico nessuno,1,6,0.0,2,1,0,0.0,0.3333,0.0,0,0.0,0.0,
953,babbalea,0,1,0.0,1,0,0,0,1.0,0.0,0,0,0,
954,reale come reale tuo totale incapacita condurre qualsiasi programma parvenze sei offesa orecchio chiunque diventare roma,1,29,0.0,1,0,3,0.0016,0.125,0.0083,1,0.13333333333333333,0.45,
955,castaldini veramente insopportabile,1,5,0.0,2,1,0,0.1146,0.0,0.0286,1,0.2,0.2,
956,ruminate,1,2,0.0,1,0,0,0,1.0,0.0,0,0,0,
957,certo votero no,0,4,0.0,1,0,0,0.0664,0.0,0.0,0,0.21428571428571427,0.5714285714285714,
958,matteo essere villano essere puro sempre signore,0,7,0.0,1,0,1,-0.0716,0.1429,0.0,0,0.21428571428571427,0.5,
959,impossibile,0,1,0.0,2,1,2,-0.2969,0.0,0.0,0,-0.6666666666666666,1.0,
960,dovere cacciare punto,1,2,0.0,2,0,1,0.0031,0.0,0.0,0,0.0,0.0,
961,malpezzi castani bicarbonato malto,1,8,0.0,2,0,1,0,0.5,0.0,0,0,0,
962,leva cola felpa,0,3,0.0,2,0,1,0.0,0.3333,0.0,0,0.0,0.0,
963,matteo quando reuccio andare casa cosa succedera parte festeggiamento popolo italiano avra possibilita votare nuovo presidente,0,24,0.0,3,1,3,0.0386,0.0625,0.0,0,0.06818181818181818,0.22727272727272727,
964,no,0,1,0.0,1,0,0,0,0.0,0.0,0,0,0,
965,ovviamente no,0,2,0.0,2,0,1,0.25,0.0,0.0,0,0.0,0.5,
966,no grazia essere troppo,0,5,0.0,4,0,3,0.0,0.0,0.0,0,0.2,0.2,
967,essere antipatia solo vedere innervosire,1,8,0.0,1,0,0,-0.1069,0.0,0.025,1,-0.2,0.6,
968,francesca bianco,0,2,0.0,1,0,0,-0.0098,0.0,0.0,0,0.0,0.0,
969,cambio subito canale solo vedere questo male dire invitare,1,14,0.0,3,0,3,-0.0858,0.0,0.0,0,-0.5,1.0,
970,voto no,0,3,0.3333,1,0,0,0.0078,0.0,0.0,0,0.0,0.0,
971,essere matteo cosa fa capire veramente questo trasmissione questo paese questo diventare sempre piu schifoso clandestino tutto diritto mentre famiglia italiano non riuscire pagare medicina euro mese moglie ed figlio malato,1,41,0.0,2,0,5,0.004,0.0,0.009,2,0.16357142857142856,0.49107142857142855,
972,assolutamente no,0,2,0.0,1,0,0,0.375,0.0,0.0,0,-0.1,0.9,
973,non reale volta molto utile,0,8,0.0,2,0,2,0.0,0.0,0.0,0,0.14500000000000002,0.15000000000000002,
974,matteo pdf piu importante legge gay,0,11,0.0909,1,0,0,0.1262,0.1667,0.0286,1,0.4388888888888889,0.6944444444444445,
975,non potere vedere santa mega spanna sopra salvini asfaltino,1,13,0.0,1,0,2,-0.0206,0.0,0.0,0,0.5,0.625,
976,matteo fatto giro presso qualsiasi sportello equivali brivido,1,12,0.0,3,3,1,-0.05,0.125,0.0,0,0.0,0.0,
977,jota non avere risolvere ad esempio problema sempre piu evidente erinni erinni cercare lavoro considerare vecchio questo societa,0,28,0.0,1,0,1,0.0068,0.1667,0.0,0,0.275,0.425,
978,pentirsi fulmine mica finire,1,7,0.0,2,1,0,0.0,0.0,0.0,0,0.0,0.0,
979,avere gia cambiare canale,0,4,0.0,1,0,0,0.022,0.0,0.0,0,0.0,0.0,
980,terribile,1,1,0.0,2,1,0,-0.6484,0.0,0.0,0,-1.0,1.0,
981,salvini essere riforma stare andare fatta non sara perfetta almeno avere cominciare ad eliminare qualcosa ciao,0,23,0.0435,2,0,2,0.0737,-0.0625,0.0,0,0.35,0.7,
982,post fazioso parte come sempre italiano fare questo cosa,0,13,0.0,2,0,2,-0.0004,0.0,0.0,0,0.0,0.0,
983,gente pericoloso sapere benissimo quello stare combinare poco sapere ridere secondo,0,15,0.0,3,0,2,-0.0807,0.0,0.0,0,-0.07187499999999998,0.45,
984,bastare cambiare canale,0,3,0.0,1,0,0,0.0011,0.0,0.0,0,0.0,0.0,
985,votero no naturalmente,0,4,0.0,1,0,0,0.0273,0.0,0.0,0,0.1,0.4,
