2253,ciao matteo oggi arrivare tuo libro questo sera inizio leggere qui amico famiglia votare no sperare cambiare cosa buono serata debbio guardare come solito amnistie,0,35,0.0,1,0,0,-0.0354,0.08,0.0,0,0.22499999999999998,0.42500000000000004,
2254,polizia vedere questo video,0,7,0.0,2,1,0,0.0064,0.0,0.0,0,0.0,0.0,
2255,essere,0,3,0.0,2,0,1,0,0.0,0.0,0,0.0,0.0,
2256,stare czar paura,1,6,0.0,1,0,0,0.0,0.3333,0.0,0,0.0,0.0,
2257,bravo matteo salvini,0,3,0.0,1,0,0,0.2027,-0.3333,0.0,0,0.7,0.6000000000000001,
2258,rimbambito foderero,0,4,0.25,2,1,0,0.1562,0.5,0.0,0,0,0,
2259,purtroppo,0,2,0.0,1,0,0,-0.4375,0.0,0.0,0,-0.5,1.0,
2260,non certo quello mummia salotto lussuoso parlare niente annusare sorteggiate,1,20,0.0,1,0,0,-0.1152,0.1,0.0,0,-0.10714285714285714,0.5714285714285714,
2261,abbracciare quello bambina tutto matteo prego,0,9,0.0,1,0,0,0.1979,0.0,0.0,0,0.2857142857142857,0.5357142857142857,
2262,passo fame nervoso,1,6,0.0,1,0,0,-0.0195,0.0,0.0,0,0.0,0.0,
2263,avere chiamata fare fatturato,0,6,0.0,2,1,0,0.0078,0.0,0.0,0,0.0,0.0,
2264,chi critica conduttore dovere proporre come sostituto consigliere,0,11,0.0,2,0,1,-0.0375,0.0,0.0,0,0.0,0.0,
2265,assolutamente no mondo creato vostro uso consumo,0,13,0.0769,3,0,2,0.0684,0.0,0.0,0,-0.1,0.9,
2266,no no no no no no ciao capitano,0,9,0.8889,1,0,1,-0.0938,0.0,0.0,0,0.0,0.0,
2267,essere attesa winking_face ,0,3,0.0,2,1,0,-0.0938,0.0,0.0,0,0.0,0.0,
2268,avere ragione virginia votero quello dire,0,8,0.0,1,0,0,0.0823,0.0,0.0,0,0.2857142857142857,0.5357142857142857,
2269,voto no primo tutto mandare via questo abusivo secondo terzo quarto questo riforma fa vetriate pena,1,22,0.0455,3,1,1,-0.0643,0.0625,0.0101,1,-0.15625,0.3333333333333333,
2270,renzi mettere autolinee degrado grande matteo salvare,1,11,0.0,3,1,3,0.0503,0.1429,0.0,0,0.8,0.75,
2271,no avere vomitare weary_face ,1,4,0.0,2,0,2,0.0,0.0,0.0588,1,0.0,0.0,
2272,,0,1,0.0,1,0,0,0,0,0,0,0,
2273,parvenze solo nome fa smollicare a,0,9,0.2222,1,0,0,0.0068,0.3333,0.0,0,0.0,1.0,
2274,non reggere piu suo contro riforme votero no secco,1,15,0.0667,3,1,2,-0.0692,0.0,0.0,0,-0.15833333333333333,0.55,
2275,questo scemo rossa avere bere brava santa salvini tappare bocca,1,13,0.0,1,0,0,0.0526,-0.1,0.0159,1,-0.03333333333333336,0.46666666666666673,
2276,non sbagliare calce vivo stare balordo,1,10,0.0,1,0,0,-0.0103,0.0,0.0263,1,-0.24621212121212122,0.6333333333333333,
2277,come su fa vivere mondo tu,0,11,0.0,2,0,1,0.061,0.3333,0.0,0,0.13636363636363635,0.5,
2278,gente chiama matta realmente,0,7,0.0,1,0,0,0.125,0.0,0.0,0,-0.19999999999999998,0.55,
2279,potere usare come mezzo anestetico rapido effetto sale operatorio dovere augurare paziente turno no risveglio,1,23,0.0,3,0,2,-0.0138,0.0,0.0,0,0.5,0.625,
2280,fare fare chi sapere fare,0,6,0.0,1,0,0,0.0182,0.0,0.0,0,0.0,0.0,
2281,proprio no,0,2,0.5,1,0,0,0.375,0.0,0.0,0,-0.1,0.9,
2282,non essere stufato essere preso giro politico italia volere dittatura solo comandare,1,25,0.0,4,2,1,0.0366,0.0,0.0,0,0.0,0.55,
2283,presidente avere domanda quando morire giusto sapere,0,9,0.0,2,1,0,-0.0404,0.0,0.0,0,0.0,0.0,
2284,sicuramente no,0,2,0.5,1,0,0,0.125,0.0,0.0,0,-0.25,0.8888888888888888,
2285,senza parola,0,2,0.0,1,0,0,-0.3125,0.0,0.0,0,0.0,0.0,
2286,venire davvero marte essere fuori ogni logica poverina,1,11,0.0,3,1,2,0.0356,0.0,0.0,0,-0.1,0.4,
2287,stare aspettare arrivo,0,6,0.0,2,1,0,0.0,0.0,0.0,0,0.0,0.0,
2288,dire solita cosa dire anno succedere anno peggiorare ogni giorno stare aspettare,0,22,0.0,3,0,4,0.038,0.0,0.0,0,-0.325,0.425,
2289,italiano mandare renzi zappare,1,5,0.0,2,1,0,0.0005,0.0,0.0,0,0.0,0.0,
2290,francia stupri parvenze,0,5,0.0,1,0,0,0,1.0,0.0,0,0.0,0.0,
2291,carita,0,2,0.5,1,0,0,-0.3448,0.0,0.0,0,-0.1875,0.5,
2292,questo topo,0,7,0.1429,2,1,0,0.0,0.5,0.0,0,0.0,0.0,
2293,forse bottiglia fernet branca,0,9,0.0,1,0,1,0.0,0.0,0.0,0,0.0,0.0,
2294,ano,0,2,0.0,1,0,0,0,1.0,0.0,0,0.0,0.0,
2295,questo aspettare,0,4,0.75,2,3,0,-0.0938,0.0,0.0,0,0.0,0.0,
2296,assolutamente no,0,2,0.0,2,1,0,0.375,0.0,0.0,0,-0.1,0.9,
2297,parola,0,3,0.0,1,0,0,0.0,0.0,0.0,0,0.0,0.0,
2298,marea cazzata,1,4,0.0,2,0,1,-0.2188,0.0,0.0769,1,0.0,0.0,
2299,eh bimbo avere solo bisogno asilo nido primo mettere mondo figlio genitore dovere avere lavoro stabile mantenere forse salvini non rendere conto quanto costa figlio appena venire mondo,0,38,0.0263,5,1,8,-0.0037,-0.0357,0.0,0,0.225,0.26666666666666666,
2300,palla,0,2,0.0,1,0,0,0.0,0.0,0.0,0,0.0,0.0,
2301,essere,0,3,0.0,1,0,0,0,0.0,0.0,0,0.0,0.0,
2302,votero no,0,2,0.0,1,0,0,0,0.0,0.0,0,0,0,
2303,puo prendere bicarbonato,0,6,0.0,1,0,0,0.0156,0.0,0.0,0,0.0,0.0,
2304,assolutamente meoni meoni o,0,6,0.3333,1,0,0,0.125,0.5,0.0,0,0.2,0.9,
2305,matta domanda certo voto no,0,7,0.0,3,2,1,-0.1133,0.0,0.0,0,-0.19285714285714284,0.7357142857142858,
2306,fare risentire vecchiata gallina starnazzare aho aho aho aho aho aho aho aho,1,14,0.0,3,2,0,-0.043,0.6923,0.0,0,0.1,0.2,
2307,gia fastidio vedere solo vedere insieme fa venire voglia rompere televisore,1,19,0.0,2,0,1,-0.0122,0.0,0.0133,1,0.0,1.0,
2308,essere scandaloso aspettare grande matteo,1,6,0.0,2,0,1,-0.0215,0.0,0.0,0,0.8,0.75,
2309,avere ragione matteo ottimo proposta,0,5,0.0,2,1,0,0.1919,0.0,0.0,0,0.6428571428571428,0.7678571428571428,
2310,iniziare girare frittata questo quanto ignobile questo essere,1,11,0.0,3,2,0,-0.043,0.0,0.0,0,0.0,0.0,
2311,assolutamente no,0,2,0.0,2,1,0,0.375,0.0,0.0,0,-0.1,0.9,
2312,voto no salvini premier subito,0,6,0.0,3,1,1,0.0547,-0.2,0.0,0,0.0,0.0,
2313,cuscini avere creato mondo oche bello zanzara avere risolvere diatriba cronisti evoluzionista quando cura raffreddore,0,25,0.04,5,2,2,0.0579,0.2,0.0085,1,0.85,1.0,
2314,voto no qualsiasi cosa puro mandare casa questo buffone,1,11,0.0,3,2,3,-0.05,0.1111,0.0182,1,0.21428571428571427,0.5,
2315,certo no,0,3,0.0,1,0,0,0.125,0.0,0.0,0,-0.10714285714285714,0.5714285714285714,
2316,distruggere,1,3,0.0,2,1,0,-0.125,0.0,0.0,0,-0.2,0.0,
2317,dovere diventare legge,0,5,0.0,1,0,0,0.0088,0.0,0.0,0,0.0,0.0,
2318,quando andare casa,0,5,0.0,1,0,0,0.0,0.0,0.0,0,0.0,0.0,
2319,quello mazza stare rappresentare pene cuscini,1,11,0.0,2,1,0,0.0,0.1667,0.0222,1,0.0,0.0,
2320,malpezzi suo dondolio capo sembrare quello cornetti mettere dietro lunotto macchina poi ridere sempre non credo stia bene stasera sempre fare dare suora pasticca gialla,1,36,0.0,2,1,1,-0.0135,0.04,0.0,0,0.0,0.0,
2321,spiacendosi,0,1,0.0,2,0,1,0,1.0,0.0,0,0,0,
2322,maledetto comunista,1,2,0.0,1,0,0,-0.1094,0.0,0.0,0,-0.8,0.9,
2323,andare bene andare bene ragazzo vincere dove andare,0,12,0.5,3,1,1,0.0837,0.0,0.0,0,0.8,0.4,
2324,stare sparare tanto cazzata fare finta scannare essere tutto do accordo piacere fare provare questo politico cosa volere dire avere lavoro sapere come fare meglio sapere mantenere tuo famiglia vedere parlare ancora coso togliere tutto fusa questo montecitorio riaprire casa tolleranza fare soldo tanto inculano lune altro,1,67,0.0,2,0,2,0.0102,0.0638,0.0031,1,0.0925,0.39249999999999996,
2325,pronto via,0,2,0.0,2,1,0,0.0312,0.0,0.0,0,0.2,0.5,
2326,no,0,1,0.0,2,1,0,0,0.0,0.0,0,0,0,
2327,questo non digerire nemmeno bicarbonato mandare lavorare terra essere persona arrogante,1,18,0.0,3,0,2,0.0107,0.0,0.0,0,0.0,0.0,
2328,maestrina,0,3,0.0,2,1,0,0.3125,0.0,0.0,0,0.0,0.0,
2329,non essere invitata non avere mai sapere mondo vivere gia espressione fare capire parlare poi,0,25,0.0,2,0,3,0.0355,0.0,0.0,0,0.13636363636363635,0.5,
2330,voto no,0,2,0.5,2,1,0,0.0078,0.0,0.0,0,0.0,0.0,
2331,voto no,0,4,0.0,2,1,0,0.0078,0.0,0.0,0,0.0,0.0,
2332,no nemmeno doppio digestivo malpezzi poi credere bello simpatica intelligente invece brutto antipatico oche sei arrivare ora ascolto matteo,1,24,0.0,3,0,2,0.0963,0.0526,0.0072,1,0.0027777777777778048,0.7972222222222222,
2333,essere ex elettore questo sinistra balordo accattone corrotta ladra ora bastare fanciullo ideologia non fare fatto ben venire chi difendere nostro casa nostro domani nostro economia soprattutto nostro sicurezza andare matteo essere,1,39,0.0256,10,1,16,-0.0436,0.0312,0.0043,1,-0.16666666666666666,0.5333333333333333,
2334,vomito astonished_face ,1,2,0.0,1,0,0,-0.0625,0.0,0.0,0,0.0,0.0,
2335,invece toccare costituzione essere bene toccare saccoccia tutto onorevole modo dire,1,17,0.0,3,0,3,0.1273,0.0,0.0,0,0.7,0.6000000000000001,
2336,no mai,0,2,0.0,1,0,0,0,0.0,0.0,0,0,0,
2337,proprio votero,0,3,0.3333,2,1,0,0.1637,0.0,0.0,0,0.0,0.0,
2338,indigeribili,1,1,0.0,2,1,0,0,0.0,0.0,0,0,0,
2339,matteo fare capire come governare paese,0,9,0.0,1,0,0,0.0524,0.0,0.0,0,0.0,0.0,
2340,alessandro,0,1,0.0,1,0,0,0.0,0.0,0.0,0,0.0,0.0,
2341,essere reale bisogna trovare lavoro andare lavorare,1,11,0.0,3,0,3,-0.0018,0.0,0.0,0,0.2,0.30000000000000004,
2342,matteo aiutare ad andare pensione anno contributo lasciare perdere tutto altro puttanata governo renzi,1,20,0.0,1,0,0,0.0023,0.0,0.0196,2,-0.10096153846153846,0.3221153846153846,
2343,voto no,0,3,0.3333,2,1,0,0.0078,0.0,0.0,0,0.0,0.0,
2344,venire vomitare,1,4,0.0,2,1,0,-0.0312,0.0,0.0667,1,0.0,0.0,
2345,fa parlare,0,5,0.0,2,1,0,0.0,0.0,0.0,0,0.0,0.0,
2346,salvini andare cambiare tutto ridare nostro paese,0,10,0.0,1,0,0,0.0006,-0.1429,0.0,0,0.0,0.0,
2347,aulica svelsero thumbs_up_medium-light_skin_tone  winking_face_with_tongue ,0,5,0.0,1,0,0,0,1.0,0.0,0,0.0,0.0,
2348,onorevole malpezzi volti sapere cosa ridere qui ce piangere vedere prossimo votazione come ridere,1,18,0.0,2,1,0,0.0002,0.0714,0.0,0,0.19999999999999998,0.06666666666666667,
2349,natura volere bene tutto non importare partito,0,11,0.8182,3,1,1,0.1688,0.0,0.0,0,0.5,0.6,
2350,verra approvare tipo sara morte patrimonio ergonomico italiano nostro cultura millenario cosa pensare presidente,0,20,0.05,2,1,2,0.0073,0.1429,0.0,0,0.0,0.0,
2351,votare quello volere non influenzare tuo adepto dire voto no,0,15,0.0,2,0,1,-0.0122,0.0,0.0,0,0.6,0.9,
2352,essere democratico,0,3,0.0,1,0,0,0.2031,0.0,0.0,0,0.0,0.0,
2353,difatti avere cambiare canale proprio non digerire,1,9,0.0,2,0,1,0.0401,0.0,0.0,0,0.0,0.0,
2354,bisogna cambiare legge eliminare giudice sinistra giudice dovere essere apolitico,1,14,0.0,1,0,1,0.0611,0.0,0.0,0,0.0,0.5,
2355,sempre,0,3,0.0,1,0,0,-0.0312,0.0,0.0,0,0.0,0.0,
2356,odioso brutto,1,3,0.0,1,0,0,-0.3773,0.0,0.0769,1,-0.7,1.0,
2357,ieri notte avere sognare essere fidanzato chissa tutto quello andare potere essere gia preso,0,19,0.0,3,0,2,-0.0117,0.0,0.0,0,0.0,0.06666666666666667,
2358,bravo matteo aggiungere mio no,0,7,0.0,2,0,2,0.2131,0.0,0.0,0,0.7,0.6000000000000001,
2359,cagare castaldini brutto pdf aiuto becero essere vomitare ditelo dire legge,1,21,0.0,1,0,0,-0.0541,0.1818,0.0267,2,-0.44999999999999996,0.9,
2360,colpa non guardo piu,0,8,0.0,1,0,0,0.1562,0.0,0.0,0,0.0,0.0,
2361,quello pdf non digerire mai,1,7,0.1429,1,0,0,-0.1035,0.2,0.0,0,0.0,0.0,
2362,pena manca solo ligandi,1,5,0.0,1,0,0,0.0208,0.25,0.0,0,0.0,1.0,
2363,ergastolo,0,1,0.0,1,0,0,0.0002,0.0,0.0,0,0.0,0.0,
2364,spiona cosa pensare dire comunque piu vicino realta rispetto mondo fatato parvenze,0,18,0.0,2,1,0,-0.0113,0.1667,0.0,0,0.0,0.0,
2365,marco essere bifolco ignorante sei tutto quello avere mettere piacere non perdere occasione dimostrare vostro basso livello argomentazione valido magari fare cambiare idea essere spazzatura adesso rispondere ancora offendere faro altrettanto non merito altro,1,45,0.0,4,1,6,-0.0168,0.0,0.0078,2,0.0,0.3,
2366,grande rocco vivo verga,0,6,0.0,1,0,0,0.146,0.25,0.0435,1,0.45,0.575,
2367,castaldini nuda bello tussah,0,10,0.0,2,1,0,0.1771,0.5,0.0,0,0.0,0.0,
2368,caso essere renzi soffrire ahime non conoscere vergogna,1,14,0.0,2,0,2,0.0808,0.125,0.0,0,0.0,0.0,
2369,renzi adda fa numi poco cesso face_with_steam_from_nose ,1,7,0.0,1,0,0,0.0004,0.5,0.0,0,-0.2,0.1,
2370,no quando essere cambio essere insopportabile quiche altro politico tipo ligandi ecc,1,15,0.0,3,0,7,-0.045,0.1667,0.0119,1,-0.125,0.375,
2371,unione civile assicurato migliaio voto,0,10,0.0,2,1,0,0.0104,0.0,0.0,0,0.0,0.0,
2372,castaldini oca oca malpezzi questo sempre dire stare fare quello non avere fatto fatto vedere come ridurre italia peggio primo,1,37,0.0,3,2,2,-0.023,0.0,0.0079,1,-0.07500000000000001,0.4666666666666667,
2373,stare matteo legge commento tuo seguace non vergone,1,16,0.0,4,3,0,0.0891,0.125,0.0,0,-0.6,0.9,
2374,gia presente spaccare tutto capitano,0,5,0.0,3,2,0,-0.0078,0.0,0.0,0,0.0,0.0,
2375,voce essere psichiatri erinni questo essere menare,1,9,0.0,3,1,2,0.0001,0.2857,0.0,0,0.0,0.0,
2376,scusa capitano proprio non riuscire buttare televisore balcone leggero tuo riassunto dopo scusa davvero non avere abbastanza salute gigante pensare,1,29,0.0,5,0,9,-0.06,0.0,0.0,0,-0.11666666666666665,0.7333333333333334,
2377,non guardo piu trasmissione sentire tutto questo contabile fa solo ingrossare fegato balla,1,20,0.0,3,1,1,-0.0719,0.0769,0.0111,1,0.0,0.0,
2378,ragazzo surf qui non svegliare vo bela bela bela fare scarpa,0,15,0.0,1,0,0,-0.0088,0.4545,0.0,0,0.0,0.0,
2379,ovviamente no,0,2,0.0,1,0,0,0.25,0.0,0.0,0,0.0,0.5,
2380,brutto affare essere comunista pure sutri,1,8,0.0,3,0,4,-0.1235,0.1667,0.0,0,-0.6999999999999998,0.6666666666666666,
2381,manco morta,0,2,0.0,2,1,0,-0.5206,0.0,0.0,0,-0.2,0.4,
2382,ricordare solo cosa politico piu bravo colui colei sapere dire piu bugia fare credere gente questo oltre ad essere antipatico essere ridicola popolo purtroppo non fa nulla non vedere piu hai stare sempre,1,43,0.0,2,0,5,0.0062,0.0303,0.0,0,0.0023809523809523963,0.7785714285714286,
2383, face_with_tears_of_joy ,0,1,0.0,1,0,0,0,0,0,0,0,
2384,ripetere come pappagallo stesso ninja pedidio,1,8,0.0,1,0,0,-0.0234,0.3333,0.0222,1,0.0,0.125,
2385,mese potere festeggiare liberazione,0,8,0.0,2,0,1,0.0222,0.0,0.0,0,0.0,0.0,
2386,odio entrambi,1,4,0.0,2,0,1,-0.375,0.0,0.0,0,-0.8,0.9,
2387,togliere legge franero gabbia salariale esportare modello lombardia matteo,0,14,0.0,2,1,1,0.0031,0.1111,0.0,0,0.0,0.0,
2388,tutto mio buono volonta stasera passo,0,8,0.0,3,0,2,0.0927,0.0,0.0,0,0.7,0.6000000000000001,
2389,no preparare grappa face_with_tears_of_joy ,0,4,0.0,2,0,2,0.0,0.0,0.0,0,0.0,0.0,
2390,non chiedere altro massacrare,1,4,0.0,1,0,1,-0.002,0.0,0.0,0,0.0,0.0,
2391,ecco comprendere,0,2,0.0,2,1,0,0.1914,0.0,0.0,0,0.0,0.0,
2392,no no no,0,4,0.0,1,0,0,0,0.0,0.0,0,0,0,
2393,cornacchia incompetente sgradevole nostro timpano,1,8,0.0,1,0,0,-0.1787,0.0,0.0,0,-0.6499999999999999,0.95,
2394,avere provare citrina bicarbonato niente fare non sopportare proprio andare tutto bene tanto fregare stare fare faccetta prendere soldo essere protetta mettere campo roma sotto casa cercare integrare,1,45,0.0,5,0,4,-0.0238,0.0714,0.005,1,0.24285714285714285,0.3678571428571429,
2395,voto no fanciullo renzi tutto renan,1,8,0.0,3,0,2,0.0156,0.3333,0.0,0,0.0,0.0,
2396,finca non chiavare inculando figlia moglie renzi compagnia bello non fa nulla culo povero cittadino non conta augurio chi votare partito democratico tutela tutto questo animale,1,38,0.0526,4,0,3,0.007,0.0,0.0114,2,0.016666666666666646,0.7333333333333334,
2397,ecco mancare solo ruggiero dire suo,0,9,0.0,2,0,1,-0.0822,0.0,0.0,0,-0.1,0.525,
2398,ruffiano,0,1,0.0,2,0,1,0,0.0,0.0,0,0,0,
2399,andare corsa bagno defecare,1,9,0.5556,3,0,2,0.0001,0.0,0.0,0,0.0,0.0,
2400,ovvio do,0,2,0.0,1,0,0,0.25,0.5,0.0,0,0.0,0.5,
2401,marco davide,0,2,0.0,1,0,0,0,0.5,0.0,0,0,0,
2402,tanto cazzata sembrare alieno vivere altro mondo essere venuto qui rompere scatola fare incazzare,1,19,0.0,4,2,2,-0.0493,0.0,0.0309,3,-0.425,0.725,
2403,no essere pesante,1,3,0.0,2,0,1,0.0156,0.0,0.0,0,-0.2,0.5,
2404,petulante insopportabile coraggio grande salvini falla tacere magari uso spray anti zanzara,1,15,0.0,6,2,3,-0.0484,-0.0833,0.022,2,0.0,0.21666666666666667,
2405,vuole donna prete andare data prete donna avere famiglia,0,17,0.0,2,0,3,0.0029,0.1111,0.0,0,0.2,0.1,
2406,fare salvini,0,4,0.0,1,0,1,0.0,-0.5,0.0,0,0.0,0.0,
2407,quanto essere coglione italiano tanto prova questo persona eleggere rappresentare popolo,1,16,0.0,2,1,0,-0.0259,0.0,0.0114,1,0.4,0.45,
2408,salvare cominciare essere simpatico,0,7,0.1429,1,0,1,0.3318,0.0,0.0,0,0.6,1.0,
2409,avere appena finire rivedere porta porta come solito sei stare grande nonostante presenza fazioso ferraccio brontoli giornalista spocchioso menzionare carraio parte brontoli strafa presidente stare penoso bravo presidente sempre avanti faccia questo personaggio gattopardi impenitente ed impunito,0,54,0.0,3,0,5,-0.0453,0.1351,0.0,0,0.1375,0.625,
2410,questo rimangiare parola ronzino mica fesso finca magno magno,1,12,0.0,4,1,4,-0.0755,0.1111,0.0328,2,-0.7999999999999999,1.0,
2411,manca stinfalo fascista sei primo lista,0,8,0.0,1,0,0,-0.0458,0.1667,0.0256,1,0.024999999999999994,0.19166666666666665,
2412,presidente non ora mettere mano disciplina paesaggio ridimensionare potere discrezionale soprintendenza evitare ad ogni cambio soprintendente bisogna rivedere tutto scelta progettuale questo materia rendere trasparente ristabilire certezza diritto,0,47,0.0213,4,1,3,-0.0084,0.0,0.0,0,0.2,0.4,
2413,essere altro problema affrontare questo solo inizio italiano stare tutto culo terra favore non fare promessa vuoto solo ottenere voto potere andare governo poi fare colombacci vostro,1,42,0.0,1,0,0,-0.0214,0.037,0.0055,1,-0.03333333333333333,0.5,
2414,andare capitano,0,2,0.0,1,0,0,0.0625,0.0,0.0,0,0.0,0.0,
2415,niente,0,2,0.0,2,1,0,0.0,0.0,0.0,0,0.0,0.0,
2416,pesante digerire come mangiare pietra,1,6,0.0,1,0,0,-0.0083,0.0,0.0,0,-0.2,0.5,
2417,,0,1,0.0,1,0,0,0,0,0,0,0,
2418,manca tasto gessetto colorato,0,7,0.0,1,0,0,-0.0739,0.0,0.0,0,-0.1,0.525,
2419,voto no renzi tutto suo manutengolo comprendere tutto quello lista maurini roma,0,19,0.8947,2,0,2,-0.0234,0.0833,0.0127,1,0.2,0.4,
2420,mutezza vendere,1,2,0.0,1,0,0,0.001,0.5,0.0,0,0.0,0.0,
2421,essere,0,2,0.0,1,0,0,0,0.0,0.0,0,0.0,0.0,
2422,,0,1,0.0,1,0,0,0,0,0,0,0,
2423,pure voto no tanto tornare casa trovare occupare suo casa perdonare hevee,0,19,0.0,2,1,2,0.0663,0.0833,0.0,0,0.1,0.1,
2424,jangada grande face_with_tears_of_joy ,0,3,0.0,1,0,0,0.0578,0.5,0.0,0,0.0,0.1,
2425,mio voto chiaro no,0,7,0.1429,2,0,1,0.253,0.0,0.0,0,0.10000000000000002,0.3833333333333333,
2426,matteo salvini essere,0,6,0.6667,1,0,1,0.0,-0.3333,0.0,0,0.0,0.0,
2427,gallina,1,3,0.0,2,1,0,-0.25,0.0,0.0,0,-0.6,0.95,
2428,mio no categorico forse avra voglia portero seggio mio nonna anno,0,20,0.05,3,2,2,0.0102,0.0,0.0,0,0.0,0.0,
2429,non proprio no,0,3,0.0,1,0,0,-0.4688,0.0,0.0,0,-0.1,0.2,
2430,reale,0,2,0.0,1,0,0,-0.0383,0.0,0.0,0,0.2,0.30000000000000004,
2431,vedere meglio altro luogo,0,8,0.0,2,0,1,0.1523,0.0,0.0,0,0.5,0.5,
2432,forza dare tutto gratis ora ecco dove trovare pagare tutto maniera onesta,0,16,0.0625,1,0,0,0.0364,0.0,0.0,0,0.5,0.8500000000000001,
2433,inguaribile,1,1,0.0,1,0,0,0.0,1.0,0.0,0,-0.5,0.6,
2434,castaldini tutto quello pdf mettere tutto questo calderone,1,15,0.0667,1,0,0,0.0001,0.125,0.0,0,0.0,0.0,
2435,perfetta cretino servizio padrone,1,8,0.0,2,0,1,0.2104,0.0,0.0303,1,1.0,1.0,
2436,certamente no,0,2,0.0,2,1,0,0.125,0.0,0.0,0,-0.10714285714285714,0.5714285714285714,
2437,asilo nido ok mastro controllato,0,8,0.25,2,0,2,0.1293,0.0,0.0,0,0.5,0.5,
2438,non questo seguire aspetto arrivo,0,8,0.0,2,1,1,0.0312,0.0,0.0,0,0.0,0.0,
2439,votero non sapere cosa ragionare non sapere parlare,1,8,0.0,3,0,4,0.011,0.0,0.0,0,0.0,0.0,
2440,allora passo formile debbio,0,7,0.0,1,0,0,-0.2061,0.5,0.0,0,0.2,0.4,
2441,usignuolo ventina gregge gregge,0,5,0.2,2,1,0,0,1.0,0.0,0,-0.23076923076923078,0.46153846153846156,
2442,,0,1,0.0,1,0,0,0,0,0,0,0,
2443,aspetto questo seccare solito litigio,0,9,0.0,1,0,0,-0.0312,0.0,0.0,0,-0.06666666666666665,0.6,
2444,voto no,0,3,0.0,2,1,0,0.0078,0.0,0.0,0,0.0,0.0,
2445,primo andare trasmissione dovere fare spiegare dirigente sanita cosa dovere dire,0,18,0.0,1,0,0,0.0156,0.0,0.0,0,0.25,0.3333333333333333,
2446,malpezzi tacere sei ridicola,1,4,0.0,2,1,0,-0.0417,0.0,0.0,0,-0.3333333333333333,1.0,
2447,strano nessun commento rosso,0,5,0.0,3,1,2,0.0573,0.0,0.0,0,-0.025,0.075,
2448,matteo chiarire volta sempre storia spot monachine avere pagare pagare attendere risposta grazia,0,20,0.0,4,3,7,0.0333,0.1538,0.0,0,0.0,0.0,
2449,tocco sentire guardare,0,6,0.0,1,0,0,0.0902,0.0,0.0,0,0.0,0.0,
2450,renzi rottamato questo claxon bullo firenze avere altro priorita,1,13,0.0,3,1,1,-0.0208,0.2222,0.0,0,-0.125,0.375,
2451,questo quello servire davvero matteo grazia,0,8,0.0,2,1,0,0.2262,0.0,0.0,0,0.2,0.2,
2452,no,0,1,0.0,2,0,1,0,0.0,0.0,0,0,0,
2453,dove dovere firmare no,0,6,0.1667,1,0,0,0.0,0.0,0.0,0,0.0,0.0,
2454,no non sopportare,1,4,0.0,2,1,1,-0.004,0.0,0.0,0,0.0,0.0,
2455,no certo no no no,0,8,0.0,2,1,1,0.0557,0.0,0.0,0,0.0,0.0,
2456,fare complimento seguire tutto tivu italia furbo sei bravo,0,15,0.0,1,0,0,0.1326,0.2222,0.0,0,0.45714285714285713,0.6214285714285714,
2457,mandare casa renzi straparlare delirare cosa dire cosa fa questo bene sembrare avere allucinazione parlare senza logica fa discorso senza sordo,0,26,0.0,8,5,2,0.0369,0.0476,0.0,0,0.7,0.6000000000000001,
2458,sbrigare trasmissione langue,0,5,0.0,2,1,0,0.0053,0.0,0.0,0,0.0,0.0,
2459,renzi vincere andare avanti coso questo strada giusto resto solo invidia,0,16,0.0,1,0,0,0.0659,0.0,0.0139,1,0.4,0.7,
2460,essere,0,2,0.0,1,0,0,0,0.0,0.0,0,0.0,0.0,
2461,essere entrambi indigesto assieme ad altro quattro persona cui nome quasi impronunciabile,1,14,0.0,2,0,2,-0.11,0.0,0.0,0,0.0,0.0,
2462,avere scordare tasto il foiba maro etc etc,0,10,0.0,1,0,1,-0.0125,0.25,0.0,0,0.0,1.0,
2463,essere isterica,1,3,0.0,1,0,0,-0.125,0.0,0.0,0,-1.0,1.0,
2464,primo renzi faccia eleggere democraticamente popolo italiano poi riparlera ora renzi dovere essere arrestare attuo tradimento violare tutto costituzione sovranita popolo italiano ultimo pure servo pena morte impiccare tutto non eletto,1,45,0.0,2,0,4,-0.0066,0.0645,0.0,0,0.17346938775510204,0.2571428571428572,
2465,incontrare sempre stesso vita parto diventare persona incontrare cuscini manifesto suo mondo non altro tutto condizionamento ricevere quando avere giorno poi poi ognuno chiama persona quello cuscini suo realta riguardare solo,0,57,0.0,3,0,5,0.0462,0.0645,0.0,0,0.0,1.0,
2466,insopportabile,1,1,0.0,2,1,0,-0.3125,0.0,0.0,0,0.0,0.0,
2467,qui volere ala chimico cugino spada,1,9,0.0,3,0,3,0.0273,0.1667,0.0,0,0.0,0.0,
2468,voto salvini referendum votero,0,9,0.0,1,0,1,0.0156,-0.25,0.0,0,0.0,0.0,
2469,votero no,0,2,0.0,1,0,0,0,0.0,0.0,0,0,0,
2470,no venire fare tivu sfoggiare abito costoso spesa news vergognarsi,1,21,0.0,1,0,0,-0.0195,0.2,0.0,0,-0.5,0.7,
2471,poi potere puntare scuola elementare poi chissa,0,10,0.0,1,0,0,0.0315,0.0,0.0,0,0.45,0.5625,
2472,maledetta zecca,1,3,0.0,3,0,2,0.0,0.0,0.0667,1,0.0,0.0,
2473,no venire cospicuamente invitata popolo non digerire piu dispiacere cambio canale tutto volta vedere tivu,1,23,0.0,1,0,0,0.0417,0.1333,0.0,0,0.5,0.5,
2474,come tutto bue bel cui attorniare renzi poco essere meteora finalmente andare lavorare,1,18,0.0,4,0,5,0.0258,0.0769,0.0,0,0.1708333333333333,0.7000000000000001,
2475,gente non avere mai lavorare vita non sapere nemmeno motivo stare questo terra stare solo fare danno,1,25,0.04,2,0,2,-0.0502,0.0,0.0,0,0.0,0.0,
2476,odioso,1,1,0.0,1,0,0,-0.125,0.0,0.0,0,0.0,0.0,
2477,aspettare dare questo maglietta,0,6,0.0,1,0,0,-0.0186,0.0,0.0,0,0.0,0.0,
2478,castaldini andare bene come controfigura paolini,0,8,0.0,2,1,0,-0.0105,0.0,0.0,0,0.0,0.0,
2479,voto no giusto coso renzi razzista italiano non mio presidente non sara mai winking_face ,1,21,0.0,1,0,2,0.0173,0.0,0.0,0,-0.07142857142857142,0.26785714285714285,
2480,pure votero no,0,4,0.0,1,0,0,0,0.0,0.0,0,0,0,
2481,guardare non essere leghista piacere dire poi mantenere renzi varo programma televisivo dire promettere grande giusto cosa cittadino italiano invece avere affossare italia ancora piu,1,38,0.0263,5,0,5,0.0228,0.0,0.0,0,0.16666666666666666,0.19999999999999998,
2482,comunista quando destra anno afa avere fatto modifica costituzione avere fatto girotondo essere stracciare vestito avere detta fare tutto colore adesso dovere avallare porcheria renzi caro marco essere stare sereno votare no,1,42,0.0238,2,0,5,0.0171,0.0625,0.0045,1,0.06190476190476191,0.7785714285714286,
2483,no no,0,2,0.0,1,0,0,0,0.0,0.0,0,0,0,
2484,dovere stare casa lasciare porre persona piu intelligente quello pdf dire solo cavolate come renzo quello altro oltre essere traditore ignorante,1,33,0.0,1,0,0,-0.0346,0.0476,0.0069,1,-0.06458333333333333,0.6770833333333334,
2485,essere stare inutile arrabbiare volere comandare nostro paese personalmente non fregare delinquere comportare bene casa mio non volere come sara tutto italia solo non avere palla dire fare comandare questo punto non lamentare subito bastare,1,64,0.0,3,0,6,-0.002,0.0,0.0042,1,-0.25,0.5,
2486,essere odioso essere costringere cambiare canale fare incazzare poi non dormire,1,15,0.0,1,0,0,-0.073,0.0,0.0253,2,-0.30000000000000004,0.2,
2487,no forero,0,2,0.5,2,1,0,0,0.5,0.0,0,0,0,
2488,essere allucinante raccontare favola,1,3,0.0,2,0,2,0.0869,0.0,0.0,0,-1.0,1.0,
2489,mondo reale senza dubbio,0,5,0.0,2,0,3,0.0469,0.0,0.0,0,0.2,0.30000000000000004,
2490,mancare solo librandi ed essere completo quanto sutri dire pensare essere tutto scemo,1,16,0.0,4,0,6,-0.0665,0.0769,0.0118,1,-0.2333333333333333,0.7999999999999999,
2491,avere mangiare poco dare insieme solo non potere digerire fortuna studio essere stanche,1,24,0.0,3,0,3,-0.0414,0.0769,0.0,0,-0.29375,0.6,
2492,aspetto,0,2,0.0,1,0,0,0.002,0.0,0.0,0,0.0,0.0,
2493,matteo troppo marcio renzi coperto mafia stare come preferire sperare sempre comunque tuo ascesa essere stufa governo scombinato pregiudicato sanguinario,1,29,0.0,7,0,7,-0.0185,0.0,0.0065,1,-0.8,0.9,
2494,ciao matteo essere comunista regalo tuo libro quasi quasi voto aspetto riso,0,18,0.0,2,0,2,-0.0117,0.0833,0.0,0,0.0,0.0,
